entry_id	year	EngganoSource	id	year_id	words	commons	commons_tokenised	ipa	ipa_tokenised
17	<1855	Brouwer <1855	2	<1855	amama	amama	a m a m a	amama	a m a m a
35	<1855	Brouwer <1855	3	<1855	adoewa	aduwa	a d u w a	aduwa	a d u w a
61	<1855	Brouwer <1855	5	<1855	poe-à-foh	pu-a-fo	p u - a - f o	pu-a-fo	p u - a - f o
75	<1855	Brouwer <1855	6	<1855	e-ai	E'a:i	E ' a:i	ɛʔai	ɛ ʔ ai
89	<1855	Brouwer <1855	7	<1855	koeloe	kulu	k u l u	kulu	k u l u
105	<1855	Brouwer <1855	8	<1855	mona	mOna	m O n a	mɔna	m ɔ n a
109	<1855	Brouwer <1855	9	<1855	akekena	akEkEna	a k E k E n a	akɛkɛna	a k ɛ k ɛ n a
125	<1855	Brouwer <1855	10	<1855	liba	liba	l i b a	liba	l i b a
143	<1855	Brouwer <1855	11	<1855	alina-adoewa	alina-aduwa	a l i n a - a d u w a	alina-aduwa	a l i n a - a d u w a
158	<1855	Brouwer <1855	12	<1855	apas-afah	apax-afah	a p a x - a f a h	apaç-afah	a p a ç - a f a h
172	<1855	Brouwer <1855	13	<1855	alima-afah	alima-afah	a l i m a - a f a h	alima-afah	a l i m a - a f a h
206	<1855	Brouwer <1855	16	<1855	amama	amama	a m a m a	amama	a m a m a
221	<1855	Brouwer <1855	17	<1855	afa	afa	a f a	afa	a f a
238	<1855	Brouwer <1855	18	<1855	hai	ha:i	h a:i	hai	h ai
256	<1855	Brouwer <1855	19	<1855	baka	baka	b a k a	baka	b a k a
274	<1855	Brouwer <1855	20	<1855	kahaa	kahaa	k a h a a	kahaa	k a h a a
297	<1855	Brouwer <1855	22	<1855	kioe	kiu	k i u	kiu	k i u
320	<1855	Brouwer <1855	25	<1855	liwoh	liwo	l i w o	liwo	l i w o
339	<1855	Brouwer <1855	27	<1855	pano-pano	panO-panO	p a n O - p a n O	panɔ-panɔ	p a n ɔ - p a n ɔ
445	<1855	Brouwer <1855	38	<1855	ko-au	kO-a:o	k O - a:o	kɔ-ao	k ɔ - ao
464	<1855	Brouwer <1855	40	<1855	kaliha	kalixa	k a l i x a	kaliça	k a l i ç a
556	<1855	Brouwer <1855	49	<1855	lahoe	lahu	l a h u	lahu	l a h u
565	<1855	Brouwer <1855	50	<1855	lebo-lebo	lEbO-lEbO	l E b O - l E b O	lɛbɔ-lɛbɔ	l ɛ b ɔ - l ɛ b ɔ
583	<1855	Brouwer <1855	51	<1855	tahoua	taho:ua	t a h o:u a	tahɔua	t a h ɔu a
614	<1855	Brouwer <1855	54	<1855	mona	mOna	m O n a	mɔna	m ɔ n a
635	<1855	Brouwer <1855	58	<1855	obi-obi	Obi-Obi	O b i - O b i	ɔbi-ɔbi	ɔ b i - ɔ b i
701	<1855	Brouwer <1855	65	<1855	pako-pako	pakO-pakO	p a k O - p a k O	pakɔ-pakɔ	p a k ɔ - p a k ɔ
715	<1855	Brouwer <1855	68	<1855	apilhoa	apilhOa	a p i l h O a	apilhɔa	a p i l h ɔ a
722	<1855	Brouwer <1855	70	<1855	oedoe	udu	u d u	udu	u d u
741	<1855	Brouwer <1855	72	<1855	taka	taka	t a k a	taka	t a k a
759	<1855	Brouwer <1855	73	<1855	tafoeloe	tafulu	t a f u l u	tafulu	t a f u l u
792	<1855	Brouwer <1855	76	<1855	djoeba[-beri-berri] ; joeba	juba[-bEri-bErri] ; yuba	j u b a [ - b E r i - b E r r i ] # ; # y u b a	d͡ʒuba[-bɛri-bɛrri] ; juba	d͡ʒ u b a [ - b ɛ r i - b ɛ r r i ] # ; # j u b a
810	<1855	Brouwer <1855	77	<1855	oeloe	ulu	u l u	ulu	u l u
971	<1855	Brouwer <1855	132	<1855	akiaki	akiaki	a k i a k i	akiaki	a k i a k i
1107	<1855	Brouwer <1855	173	<1855	abeha	abEha	a b E h a	abɛha	a b ɛ h a
1403	<1855	Brouwer <1855	254	<1855	[djoeba-]beri-berri	[juba-]bEri-bErri	[ j u b a - ] b E r i - b E r r i	[d͡ʒuba-]bɛri-bɛrri	[ d͡ʒ u b a - ] b ɛ r i - b ɛ r r i
1530	<1855	Brouwer <1855	293	<1855	parakidai	parakida:i	p a r a k i d a:i	parakidai	p a r a k i d ai
1584	<1855	Brouwer <1855	308	<1855	johé[-adoedoe]	yOhe[-adudu]	y O h e [ - a d u d u ]	jɔhe[-adudu]	j ɔ h e [ - a d u d u ]
1676	<1855	Brouwer <1855	344	<1855	boeka-koeka	buka-kuka	b u k a - k u k a	buka-kuka	b u k a - k u k a
1694	<1855	Brouwer <1855	353	<1855	e-wa	E'wa	E ' w a	ɛʔwa	ɛ ʔ w a
1741	<1855	Brouwer <1855	368	<1855	oko	OkO	O k O	ɔkɔ	ɔ k ɔ
1776	<1855	Brouwer <1855	379	<1855	kokoh	kOko	k O k o	kɔko	k ɔ k o
1790	<1855	Brouwer <1855	381	<1855	kili-kili	kili-kili	k i l i - k i l i	kili-kili	k i l i - k i l i
1852	<1855	Brouwer <1855	403	<1855	kokaio	kOka:iO	k O k a:i O	kɔkaiɔ	k ɔ k ai ɔ
1869	<1855	Brouwer <1855	409	<1855	konini	kOnini	k O n i n i	kɔnini	k ɔ n i n i
1918	<1855	Brouwer <1855	428	<1855	a-foh	a-fo	a - f o	a-fo	a - f o
2032	<1855	Brouwer <1855	471	<1855	kelé-leya	kEle-lEya	k E l e - l E y a	kɛle-lɛja	k ɛ l e - l ɛ j a
2075	<1855	Brouwer <1855	485	<1855	kalekoko	kalEkOkO	k a l E k O k O	kalɛkɔkɔ	k a l ɛ k ɔ k ɔ
2107	<1855	Brouwer <1855	494	<1855	oefah	ufah	u f a h	ufah	u f a h
2140	<1855	Brouwer <1855	507	<1855	ko-au kakoeka	kO-a:o kakuka	k O - a:o # k a k u k a	kɔ-ao kakuka	k ɔ - ao # k a k u k a
2231	<1855	Brouwer <1855	542	<1855	tob	tOb	t O b	tɔb	t ɔ b
2287	<1855	Brouwer <1855	560	<1855	proba	prOba	p r O b a	prɔba	p r ɔ b a
2419	<1855	Brouwer <1855	617	<1855	wafoh	wafo	w a f o	wafo	w a f o
2505	<1855	Brouwer <1855	654	<1855	lopoh	lOpo	l O p o	lɔpo	l ɔ p o
2839	<1855	Brouwer <1855	772	<1855	pafoeroe	pafuru	p a f u r u	pafuru	p a f u r u
2850	<1855	Brouwer <1855	776	<1855	kakoliaw	kakOlia:u	k a k O l i a:u	kakɔliau	k a k ɔ l i au
3063	<1855	Brouwer <1855	863	<1855	ko-on	kO-On	k O - O n	kɔ-ɔn	k ɔ - ɔ n
3127	<1855	Brouwer <1855	884	<1855	pajohèka	payOhEka	p a y O h E k a	pajɔhɛka	p a j ɔ h ɛ k a
3213	<1855	Brouwer <1855	910	<1855	kwé-kwé	kwe-kwe	k w e - k w e	kwe-kwe	k w e - k w e
3263	<1855	Brouwer <1855	931	<1855	amimi	amimi	a m i m i	amimi	a m i m i
3370	<1855	Brouwer <1855	969	<1855	[moko-]dobo ; [panoekoe-am]dobo	[mOkO-]dObO ; [panuku-am]dObO	[ m O k O - ] d O b O # ; # [ p a n u k u - a m ] d O b O	[mɔkɔ-]dɔbɔ ; [panuku-am]dɔbɔ	[ m ɔ k ɔ - ] d ɔ b ɔ # ; # [ p a n u k u - a m ] d ɔ b ɔ
3435	<1855	Brouwer <1855	984	<1855	hanoh	hano	h a n o	hano	h a n o
3719	<1855	Brouwer <1855	1101	<1855	praauw	praa:ow	p r a a:o w	praaow	p r a ao w
3875	<1855	Brouwer <1855	1159	<1855	e-au	E'a:o	E ' a:o	ɛʔao	ɛ ʔ ao
3888	<1855	Brouwer <1855	1161	<1855	kefoh	kEfo	k E f o	kɛfo	k ɛ f o
3954	<1855	Brouwer <1855	1190	<1855	lehao	lEha:O	l E h a:O	lɛhaɔ	l ɛ h aɔ
4003	<1855	Brouwer <1855	1213	<1855	poeroe[-takah]	puru[-takah]	p u r u [ - t a k a h ]	puru[-takah]	p u r u [ - t a k a h ]
4038	<1855	Brouwer <1855	1221	<1855	fiko-fiko	fikO-fikO	f i k O - f i k O	fikɔ-fikɔ	f i k ɔ - f i k ɔ
4231	<1855	Brouwer <1855	1296	<1855	kalikoko	kalikOkO	k a l i k O k O	kalikɔkɔ	k a l i k ɔ k ɔ
4369	<1855	Brouwer <1855	1352	<1855	pajih	payix	p a y i x	pajiç	p a j i ç
4413	<1855	Brouwer <1855	1371	<1855	moko[-dobo]	mOkO[-dObO]	m O k O [ - d O b O ]	mɔkɔ[-dɔbɔ]	m ɔ k ɔ [ - d ɔ b ɔ ]
4515	<1855	Brouwer <1855	1409	<1855	koero-bakka	kurO-bakka	k u r O - b a k k a	kurɔ-bakka	k u r ɔ - b a k k a
4565	<1855	Brouwer <1855	1432	<1855	nika-nika(?)	nika-nika(?)	n i k a - n i k a ( ? )	nika-nika(?)	n i k a - n i k a ( ? )
4579	<1855	Brouwer <1855	1436	<1855	kiea	kiia	k ii a	kiːa	k iː a
4607	<1855	Brouwer <1855	1442	<1855	kakoa	kakOa	k a k O a	kakɔa	k a k ɔ a
4628	<1855	Brouwer <1855	1447	<1855	kaha	kaha	k a h a	kaha	k a h a
4744	<1855	Brouwer <1855	1480	<1855	foe-à-noh	fu-a-no	f u - a - n o	fu-a-no	f u - a - n o
4817	<1855	Brouwer <1855	1503	<1855	koleh[-lofoh]	kOle[-lOfOh]	k O l e [ - l O f O h ]	kɔle[-lɔfɔh]	k ɔ l e [ - l ɔ f ɔ h ]
4885	<1855	Brouwer <1855	1528	<1855	oedji	uji	u j i	ud͡ʒi	u d͡ʒ i
4992	<1855	Brouwer <1855	1579	<1855	loehoe	luhu	l u h u	luhu	l u h u
4999	<1855	Brouwer <1855	1581	<1855	oedji	uji	u j i	ud͡ʒi	u d͡ʒ i
5041	<1855	Brouwer <1855	1596	<1855	kaka	kaka	k a k a	kaka	k a k a
5083	<1855	Brouwer <1855	1615	<1855	pfoeai	pfua:i	p f u a:i	pfuai	p f u ai
5116	<1855	Brouwer <1855	1629	<1855	abi-abi	abi-abi	a b i - a b i	abi-abi	a b i - a b i
5326	<1855	Brouwer <1855	1719	<1855	bio-bio	biO-biO	b i O - b i O	biɔ-biɔ	b i ɔ - b i ɔ
5378	<1855	Brouwer <1855	1737	<1855	ho-ah	hO-ah	h O - a h	hɔ-ah	h ɔ - a h
5406	<1855	Brouwer <1855	1746	<1855	ome-ome	OmE-OmE	O m E - O m E	ɔmɛ-ɔmɛ	ɔ m ɛ - ɔ m ɛ
5441	<1855	Brouwer <1855	1759	<1855	[koa-]pidjoe	[kOa-]piju	[ k O a - ] p i j u	[kɔa-]pid͡ʒu	[ k ɔ a - ] p i d͡ʒ u
5512	<1855	Brouwer <1855	1791	<1855	faé	fa:e	f a:e	faɛ	f aɛ
5544	<1855	Brouwer <1855	1802	<1855	nakoh-nakoh	nakOh-nako	n a k O h - n a k o	nakɔh-nako	n a k ɔ h - n a k o
5566	<1855	Brouwer <1855	1805	<1855	biloa	bilOa	b i l O a	bilɔa	b i l ɔ a
5595	<1855	Brouwer <1855	1815	<1855	kokoa	kOkOa	k O k O a	kɔkɔa	k ɔ k ɔ a
5744	<1855	Brouwer <1855	1871	<1855	lofoh-froba	lOfOh-frOba	l O f O h - f r O b a	lɔfɔh-frɔba	l ɔ f ɔ h - f r ɔ b a
6062	<1855	Brouwer <1855	1980	<1855	kakonini	kakOnini	k a k O n i n i	kakɔnini	k a k ɔ n i n i
6298	<1855	Brouwer <1855	2065	<1855	bahoea	bahua	b a h u a	bahua	b a h u a
6313	<1855	Brouwer <1855	2070	<1855	fokeh-fokeh	fOke-fOke	f O k e - f O k e	fɔke-fɔke	f ɔ k e - f ɔ k e
6488	<1855	Brouwer <1855	2146	<1855	foeka	fuka	f u k a	fuka	f u k a
6579	<1855	Brouwer <1855	2177	<1855	amaja	amaya	a m a y a	amaja	a m a j a
6691	<1855	Brouwer <1855	2221	<1855	pokia	pOkia	p O k i a	pɔkia	p ɔ k i a
6978	<1855	Brouwer <1855	2314	<1855	mino-ai	minO-a:i	m i n O - a:i	minɔ-ai	m i n ɔ - ai
6998	<1855	Brouwer <1855	2320	<1855	dioh	dio	d i o	dio	d i o
7022	<1855	Brouwer <1855	2323	<1855	nini	nini	n i n i	nini	n i n i
7063	<1855	Brouwer <1855	2341	<1855	koa[-pidjoe]	kOa[-piju]	k O a [ - p i j u ]	kɔa[-pid͡ʒu]	k ɔ a [ - p i d͡ʒ u ]
7105	<1855	Brouwer <1855	2358	<1855	okoha	OkOha	O k O h a	ɔkɔha	ɔ k ɔ h a
7164	<1855	Brouwer <1855	2382	<1855	kiema	kiima	k ii m a	kiːma	k iː m a
7629	<1855	Brouwer <1855	2547	<1855	adoedoe ; [johé-]adoedoe	adudu ; [yOhe-]adudu	a d u d u # ; # [ y O h e - ] a d u d u	adudu ; [jɔhe-]adudu	a d u d u # ; # [ j ɔ h e - ] a d u d u
