entry_id	year	EngganoSource	id	year_id	words	commons	commons_tokenised	ipa	ipa_tokenised
12	1987	Kähler 1987	1	1987K	ehuda	ehuda	e h u d a	ehuda	e h u d a
29	1987	Kähler 1987	2	1987K	ẽ-mãnĩ	ẽ-mãnĩ	ẽ - m ã n ĩ	ẽ-mãnĩ	ẽ - m ã n ĩ
48	1987	Kähler 1987	3	1987K	ʔadua ; ʔarua ; ʔalua	'adua ; 'arua ; 'alua	' a d u a # ; # ' a r u a # ; # ' a l u a	ʔadua ; ʔarua ; ʔalua	ʔ a d u a # ; # ʔ a r u a # ; # ʔ a l u a
71	1987	Kähler 1987	5	1987K	e-ʔapo	e-'apo	e - ' a p o	e-ʔapo	e - ʔ a p o
84	1987	Kähler 1987	6	1987K	eae	eae	e a e	eae	e a e
100	1987	Kähler 1987	7	1987K	ʔakodu ; ʔakoru	'akodu ; 'akoru	' a k o d u # ; # ' a k o r u	ʔakodu ; ʔakoru	ʔ a k o d u # ; # ʔ a k o r u
121	1987	Kähler 1987	9	1987K	ʔãkĩãkĩnã	'ãkĩãkĩnã	' ã k ĩ ã k ĩ n ã	ʔãkĩãkĩnã	ʔ ã k ĩ ã k ĩ n ã
137	1987	Kähler 1987	10	1987K	ʔadiba	'adiba	' a d i b a	ʔadiba	ʔ a d i b a
154	1987	Kähler 1987	11	1987K	ʔadiba hī ʔadua	'adiba hii 'adua	' a d i b a # h ii # ' a d u a	ʔadiba hiː ʔadua	ʔ a d i b a # h iː # ʔ a d u a
169	1987	Kähler 1987	12	1987K	ʔáopa hī ʔáopa	'áopa hii 'áopa	' á o p a # h ii # ' á o p a	ʔáopa hiː ʔáopa	ʔ á o p a # h iː # ʔ á o p a
190	1987	Kähler 1987	14	1987K	ʔadiba ekaka	'adiba ekaka	' a d i b a # e k a k a	ʔadiba ekaka	ʔ a d i b a # e k a k a
204	1987	Kähler 1987	15	1987K	ẽ-ãmãhã	ẽ-ãmãhã	ẽ - ã m ã h ã	ẽ-ãmãhã	ẽ - ã m ã h ã
218	1987	Kähler 1987	16	1987K	ãmã	ãmã	ã m ã	ãmã	ã m ã
232	1987	Kähler 1987	17	1987K	ʔáopa	'áopa	' á o p a	ʔáopa	ʔ á o p a
251	1987	Kähler 1987	18	1987K	kahaiʔi	kahai'i	k a h a i ' i	kahaiʔi	k a h a i ʔ i
269	1987	Kähler 1987	19	1987K	e-baka	e-baka	e - b a k a	e-baka	e - b a k a
286	1987	Kähler 1987	20	1987K	e-baka u-kahaʔo	e-baka u-kaha'o	e - b a k a # u - k a h a ' o	e-baka u-kahaʔo	e - b a k a # u - k a h a ʔ o
307	1987	Kähler 1987	22	1987K	e-kiu	e-kiu	e - k i u	e-kiu	e - k i u
319	1987	Kähler 1987	24	1987K	kabahedi	kabahedi	k a b a h e d i	kabahedi	k a b a h e d i
328	1987	Kähler 1987	25	1987K	e-boo	e-boo	e - b o o	e-boo	e - b o o
337	1987	Kähler 1987	26	1987K	kĩnõõ	kĩnõõ	k ĩ n õ õ	kĩnɔ͂ɔ͂	k ĩ n ɔ͂ ɔ͂
352	1987	Kähler 1987	27	1987K	ẽ-pãnũ	ẽ-pãnũ	ẽ - p ã n ũ	ẽ-pãnũ	ẽ - p ã n ũ
367	1987	Kähler 1987	28	1987K	eara ; eada	eara ; eada	e a r a # ; # e a d a	eara ; eada	e a r a # ; # e a d a
384	1987	Kähler 1987	31	1987K	kab-éʔeu	kab-é'eu	k a b - é ' e u	kab-éʔeu	k a b - é ʔ e u
397	1987	Kähler 1987	32	1987K	k-itɨ	k-itu̇	k - i t u̇	k-itɨ	k - i t ɨ
412	1987	Kähler 1987	33	1987K	ka-ʔao	ka-'ao	k a - ' a o	ka-ʔao	k a - ʔ a o
424	1987	Kähler 1987	35	1987K	k-a(h)a ; k-áhae	k-a(h)a ; k-áhae	k - a ( h ) a # ; # k - á h a e	k-a(h)a ; k-áhae	k - a ( h ) a # ; # k - á h a e
434	1987	Kähler 1987	36	1987K	kahaiʔi e-kaka	kahai'i e-kaka	k a h a i ' i # e - k a k a	kahaiʔi e-kaka	k a h a i ʔ i # e - k a k a
441	1987	Kähler 1987	37	1987K	epae	epae	e p a e	epae	e p a e
459	1987	Kähler 1987	39	1987K	kaʔi-koko	ka'i-koko	k a ' i - k o k o	kaʔi-koko	k a ʔ i - k o k o
476	1987	Kähler 1987	40	1987K	e-kadiha	e-kadixa	e - k a d i x a	e-kadiça	e - k a d i ç a
512	1987	Kähler 1987	45	1987K	kixĩãmã	kixĩãmã	k i x ĩ ã m ã	kiçĩãmã	k i ç ĩ ã m ã
522	1987	Kähler 1987	46	1987K	kəda	ku̇da	k u̇ d a	kɨda	k ɨ d a
537	1987	Kähler 1987	47	1987K	ekitai ; ekidai ; ekidei ; ekitei	ekitai ; ekidai ; ekidei ; ekitei	e k i t a i # ; # e k i d a i # ; # e k i d e i # ; # e k i t e i	ekitai ; ekidai ; ekidei ; ekitei	e k i t a i # ; # e k i d a i # ; # e k i d e i # ; # e k i t e i
578	1987	Kähler 1987	50	1987K	ebō	eboo	e b oo	eboː	e b oː
593	1987	Kähler 1987	51	1987K	edohoao ; edohəao ; etohəao ; etohoao ; ebodoá͜ua	edohoao ; edohu̇ao ; etohu̇ao ; etohoao ; ebodoá:ua	e d o h o a o # ; # e d o h u̇ a o # ; # e t o h u̇ a o # ; # e t o h o a o # ; # e b o d o á: u a	edohoao ; edohɨao ; etohɨao ; etohoao ; ebodoá͜ua	e d o h o a o # ; # e d o h ɨ a o # ; # e t o h ɨ a o # ; # e t o h o a o # ; # e b o d o á͜ u a
618	1987	Kähler 1987	54	1987K	ekãmũnãĩyõ	ekãmũnãĩyõ	e k ã m ũ n ã ĩ y õ	ekãmũnãĩjɔ͂	e k ã m ũ n ã ĩ j ɔ͂
625	1987	Kähler 1987	56	1987K	ki-ʔoʔoʔoi	ki-'o'o'oi	k i - ' o ' o ' o i	ki-ʔoʔoʔoi	k i - ʔ o ʔ o ʔ o i
647	1987	Kähler 1987	58	1987K	e-ʔobi	e-'obi	e - ' o b i	e-ʔobi	e - ʔ o b i
668	1987	Kähler 1987	61	1987K	kabeho	kabeho	k a b e h o	kabeho	k a b e h o
679	1987	Kähler 1987	62	1987K	abu-hui	abu-hui	a b u - h u i	abu-hui	a b u - h u i
698	1987	Kähler 1987	64	1987K	k(i)odi ; kaha͜odi	k(i)odi ; kaha:odi	k ( i ) o d i # ; # k a h a: o d i	k(i)odi ; kaha͜odi	k ( i ) o d i # ; # k a h a͜ o d i
711	1987	Kähler 1987	66	1987K	ki-ʔúohe	ki-'úohe	k i - ' ú o h e	ki-ʔúohe	k i - ʔ ú o h e
734	1987	Kähler 1987	70	1987K	e-pududui	e-pududui	e - p u d u d u i	e-pududui	e - p u d u d u i
754	1987	Kähler 1987	72	1987K	etaka ; ekaka	etaka ; ekaka	e t a k a # ; # e k a k a	etaka ; ekaka	e t a k a # ; # e k a k a
768	1987	Kähler 1987	73	1987K	kahapudu	kahapudu	k a h a p u d u	kahapudu	k a h a p u d u
787	1987	Kähler 1987	75	1987K	ʔua	'ua	' u a	ʔua	ʔ u a
807	1987	Kähler 1987	76	1987K	euba ; euabai	euba ; euabai	e u b a # ; # e u a b a i	euba ; euabai	e u b a # ; # e u a b a i
823	1987	Kähler 1987	77	1987K	e-udu	e-udu	e - u d u	e-udu	e - u d u
833	1987	Kähler 1987	78	1987K	itebe ; idebe	itebe ; idebe	i t e b e # ; # i d e b e	itebe ; idebe	i t e b e # ; # i d e b e
836	1987	Kähler 1987	79	1987K	yapaua	yapaua	y a p a u a	japaua	j a p a u a
840	1987	Kähler 1987	82	1987K	kikəʔəka	kiku̇'u̇ka	k i k u̇ ' u̇ k a	kikɨʔɨka	k i k ɨ ʔ ɨ k a
845	1987	Kähler 1987	84	1987K	pakũkũ hĩ	pakũkũ hĩ	p a k ũ k ũ # h ĩ	pakũkũ hĩ	p a k ũ k ũ # h ĩ
847	1987	Kähler 1987	85	1987K	kaʔara	ka'ara	k a ' a r a	kaʔara	k a ʔ a r a
851	1987	Kähler 1987	86	1987K	epanõmãʔã	epanõmã'ã	e p a n õ m ã ' ã	epanɔ͂mãʔã	e p a n ɔ͂ m ã ʔ ã
857	1987	Kähler 1987	88	1987K	kahãhõ	kahãhõ	k a h ã h õ	kahãhɔ͂	k a h ã h ɔ͂
860	1987	Kähler 1987	89	1987K	ahō	ahoo	a h oo	ahoː	a h oː
868	1987	Kähler 1987	94	1987K	kahinũãpẽ	kahinũãpẽ	k a h i n ũ ã p ẽ	kahinũãpẽ	k a h i n ũ ã p ẽ
881	1987	Kähler 1987	98	1987K	kídera ; kítera	kídera ; kítera	k í d e r a # ; # k í t e r a	kidera ; kitera	k i d e r a # ; # k i t e r a
895	1987	Kähler 1987	103	1987K	panẽ̄	panẽẽ	p a n ẽẽ	panẽː	p a n ẽː
902	1987	Kähler 1987	107	1987K	hō	hoo	h oo	hoː	h oː
911	1987	Kähler 1987	108	1987K	abəha	abu̇ha	a b u̇ h a	abɨha	a b ɨ h a
922	1987	Kähler 1987	112	1987K	enãʔãpũã	enã'ãpũã	e n ã ' ã p ũ ã	enãʔãpũã	e n ã ʔ ã p ũ ã
923	1987	Kähler 1987	113	1987K	(ʔ)ũpũ	(')ũpũ	( ' ) ũ p ũ	(ʔ)ũpũ	( ʔ ) ũ p ũ
926	1987	Kähler 1987	114	1987K	eãpãkũ	eãpãkũ	e ã p ã k ũ	eãpãkũ	e ã p ã k ũ
928	1987	Kähler 1987	116	1987K	kikoa	kikoa	k i k o a	kikoa	k i k o a
936	1987	Kähler 1987	118	1987K	hī ; he	hii ; he	h ii # ; # h e	hiː ; he	h iː # ; # h e
952	1987	Kähler 1987	125	1987K	ekadixa uae	ekadixa uae	e k a d i x a # u a e	ekadiça uae	e k a d i ç a # u a e
962	1987	Kähler 1987	128	1987K	edadi ; kadi	edadi ; kadi	e d a d i # ; # k a d i	edadi ; kadi	e d a d i # ; # k a d i
970	1987	Kähler 1987	131	1987K	ekixo	ekixo	e k i x o	ekiço	e k i ç o
977	1987	Kähler 1987	133	1987K	eupo	eupo	e u p o	eupo	e u p o
981	1987	Kähler 1987	135	1987K	pauahaʔa͜[o]	pauaha'a[:o]	p a u a h a ' a [: o ]	pauahaʔa͜[o]	p a u a h a ʔ a͜ [ o ]
987	1987	Kähler 1987	137	1987K	eparaha͜odi	eparaha:odi	e p a r a h a: o d i	eparaha͜odi	e p a r a h a͜ o d i
988	1987	Kähler 1987	138	1987K	eʔā uʔapo	e'aa u'apo	e ' aa # u ' a p o	eʔaː uʔapo	e ʔ aː # u ʔ a p o
992	1987	Kähler 1987	139	1987K	eʔaroʔopa ; eʔaropa ; eʔarupa	e'aro'opa ; e'aropa ; e'arupa	e ' a r o ' o p a # ; # e ' a r o p a # ; # e ' a r u p a	eʔaroʔopa ; eʔaropa ; eʔarupa	e ʔ a r o ʔ o p a # ; # e ʔ a r o p a # ; # e ʔ a r u p a
998	1987	Kähler 1987	140	1987K	kipakẽʔẽ	kipakẽ'ẽ	k i p a k ẽ ' ẽ	kipakẽʔẽ	k i p a k ẽ ʔ ẽ
1001	1987	Kähler 1987	141	1987K	epahanẽkũ	epahanẽkũ	e p a h a n ẽ k ũ	epahanẽkũ	e p a h a n ẽ k ũ
1003	1987	Kähler 1987	142	1987K	hо̄ abakəʔa	hoo abaku̇'a	h oo # a b a k u̇ ' a	hoː abakɨʔa	h oː # a b a k ɨ ʔ a
1010	1987	Kähler 1987	144	1987K	eara uipikoʔo͜i	eara uipiko'o:i	e a r a # u i p i k o ' o: i	eara uipikoʔo͜i	e a r a # u i p i k o ʔ o͜ i
1013	1987	Kähler 1987	145	1987K	ʔũmãhã́ũ	'ũmãhã́ũ	' ũ m ã h ã́ ũ	ʔũmãhã́ũ	ʔ ũ m ã h ã́ ũ
1014	1987	Kähler 1987	146	1987K	kinãʔã͜uã	kinã'ã:uã	k i n ã ' ã: u ã	kinãʔã͜uã	k i n ã ʔ ã͜ u ã
1029	1987	Kähler 1987	150	1987K	epũʔã	epũ'ã	e p ũ ' ã	epũʔã	e p ũ ʔ ã
1037	1987	Kähler 1987	151	1987K	e-ah(a)oi	e-ah(a)oi	e - a h ( a ) o i	e-ah(a)oi	e - a h ( a ) o i
1043	1987	Kähler 1987	152	1987K	kinũnṹhũĩ	kinũnṹhũĩ	k i n ũ n ṹ h ũ ĩ	kinũnṹhũĩ	k i n ũ n ṹ h ũ ĩ
1059	1987	Kähler 1987	158	1987K	eohodiki	eohodiki	e o h o d i k i	eohodiki	e o h o d i k i
1067	1987	Kähler 1987	160	1987K	kahao [ehuda/ẽmãnĩ]	kahao [ehuda/ẽmãnĩ]	k a h a o # [ e h u d a / ẽ m ã n ĩ ]	kahao [ehuda/ẽmãnĩ]	k a h a o # [ e h u d a / ẽ m ã n ĩ ]
1070	1987	Kähler 1987	161	1987K	kipadəpaʔa	kipadu̇pa'a	k i p a d u̇ p a ' a	kipadɨpaʔa	k i p a d ɨ p a ʔ a
1071	1987	Kähler 1987	162	1987K	pa-ʔipaʔa	pa-'ipa'a	p a - ' i p a ' a	pa-ʔipaʔa	p a - ʔ i p a ʔ a
1077	1987	Kähler 1987	163	1987K	ekehe	ekehe	e k e h e	ekehe	e k e h e
1084	1987	Kähler 1987	165	1987K	ekahupou	ekahupou	e k a h u p o u	ekahupou	e k a h u p o u
1086	1987	Kähler 1987	166	1987K	ekãhãõ ; ekahau	ekãhãõ ; ekahau	e k ã h ã õ # ; # e k a h a u	ekãhãɔ͂ ; ekahau	e k ã h ã ɔ͂ # ; # e k a h a u
1088	1987	Kähler 1987	167	1987K	ekũkã	ekũkã	e k ũ k ã	ekũkã	e k ũ k ã
1093	1987	Kähler 1987	168	1987K	ká͜ibu	ká:ibu	k á: i b u	ká͜ibu	k á͜ i b u
1101	1987	Kähler 1987	171	1987K	enẽnẽã	enẽnẽã	e n ẽ n ẽ ã	enẽnẽã	e n ẽ n ẽ ã
1106	1987	Kähler 1987	172	1987K	kikaʔana	kika'ana	k i k a ' a n a	kikaʔana	k i k a ʔ a n a
1116	1987	Kähler 1987	173	1987K	e(ʔ)abeha	e(')abeha	e ( ' ) a b e h a	e(ʔ)abeha	e ( ʔ ) a b e h a
1119	1987	Kähler 1987	174	1987K	ẽ-pã-pṹ́ʔũ	ẽ-pã-pṹ'ũ	ẽ - p ã - p ṹ ' ũ	ẽ-pã-pṹʔũ	ẽ - p ã - p ṹ ʔ ũ
1128	1987	Kähler 1987	176	1987K	eʔito ; eido	e'ito ; eido	e ' i t o # ; # e i d o	eʔito ; eido	e ʔ i t o # ; # e i d o
1131	1987	Kähler 1987	177	1987K	e-kibáha͜(u)	e-kibáha(:u)	e - k i b á h a (: u )	e-kibáha͜(u)	e - k i b á h a͜ ( u )
1137	1987	Kähler 1987	179	1987K	eʔudi ukuo	e'udi ukuo	e ' u d i # u k u o	eʔudi ukuo	e ʔ u d i # u k u o
1140	1987	Kähler 1987	181	1987K	kipakúaʔa	kipakúa'a	k i p a k ú a ' a	kipakúaʔa	k i p a k ú a ʔ a
1146	1987	Kähler 1987	182	1987K	eõnõnĩ	eõnõnĩ	e õ n õ n ĩ	eɔ͂nɔ͂nĩ	e ɔ͂ n ɔ͂ n ĩ
1149	1987	Kähler 1987	183	1987K	ekanãhã͜unĩ	ekanãhã:unĩ	e k a n ã h ã: u n ĩ	ekanãhã͜unĩ	e k a n ã h ã͜ u n ĩ
1152	1987	Kähler 1987	184	1987K	ekadabə́ʔa	ekadabu̇́'a	e k a d a b u̇́ ' a	ekadabɨ́ʔa	e k a d a b ɨ́ ʔ a
1159	1987	Kähler 1987	186	1987K	keke	keke	k e k e	keke	k e k e
1163	1987	Kähler 1987	187	1987K	kitə ; kito	kitu̇ ; kito	k i t u̇ # ; # k i t o	kitɨ ; kito	k i t ɨ # ; # k i t o
1168	1987	Kähler 1987	190	1987K	kixuo	kixuo	k i x u o	kiçuo	k i ç u o
1170	1987	Kähler 1987	192	1987K	kiʔabuki	ki'abuki	k i ' a b u k i	kiʔabuki	k i ʔ a b u k i
1176	1987	Kähler 1987	193	1987K	kikia	kikia	k i k i a	kikia	k i k i a
1182	1987	Kähler 1987	194	1987K	ehao ; ehaəhəaə ; ehahəao	ehao ; ehau̇hu̇au̇ ; ehahu̇ao	e h a o # ; # e h a u̇ h u̇ a u̇ # ; # e h a h u̇ a o	ehao ; ehaɨhɨaɨ ; ehahɨao	e h a o # ; # e h a ɨ h ɨ a ɨ # ; # e h a h ɨ a o
1184	1987	Kähler 1987	195	1987K	ehedia	ehedia	e h e d i a	ehedia	e h e d i a
1186	1987	Kähler 1987	196	1987K	eʔoki	e'oki	e ' o k i	eʔoki	e ʔ o k i
1191	1987	Kähler 1987	197	1987K	kahoʔoaki	kaho'oaki	k a h o ' o a k i	kahoʔoaki	k a h o ʔ o a k i
1199	1987	Kähler 1987	198	1987K	eporod(o͜)ipo ; eporoʔo͜ipo	eporod(o:)ipo ; eporo'o:ipo	e p o r o d ( o :) i p o # ; # e p o r o ' o: i p o	eporod(o͜)ipo ; eporoʔo͜ipo	e p o r o d ( o͜ ) i p o # ; # e p o r o ʔ o͜ i p o
1203	1987	Kähler 1987	200	1987K	kakĩ́mũ	kakĩ́mũ	k a k ĩ́ m ũ	kakĩ́mũ	k a k ĩ́ m ũ
1206	1987	Kähler 1987	201	1987K	(ápe) a-	(ápe) a-	( á p e ) # a -	(ápe) a-	( á p e ) # a -
1214	1987	Kähler 1987	205	1987K	eʔuehea	e'uehea	e ' u e h e a	eʔuehea	e ʔ u e h e a
1217	1987	Kähler 1987	206	1987K	eãmĩã	eãmĩã	e ã m ĩ ã	eãmĩã	e ã m ĩ ã
1222	1987	Kähler 1987	208	1987K	ebixu	ebixu	e b i x u	ebiçu	e b i ç u
1230	1987	Kähler 1987	211	1987K	(i)yáudu	(i)yáudu	( i ) y á u d u	(i)jáudu	( i ) j á u d u
1232	1987	Kähler 1987	212	1987K	halē ; hadē	halee ; hadee	h a l ee # ; # h a d ee	haleː ; hadeː	h a l eː # ; # h a d eː
1236	1987	Kähler 1987	213	1987K	kahinũã	kahinũã	k a h i n ũ ã	kahinũã	k a h i n ũ ã
1240	1987	Kähler 1987	214	1987K	ka?akəhəa	ka?aku̇hu̇a	k a ? a k u̇ h u̇ a	ka?akɨhɨa	k a ? a k ɨ h ɨ a
1244	1987	Kähler 1987	215	1987K	kipehe ; kapehei	kipehe ; kapehei	k i p e h e # ; # k a p e h e i	kipehe ; kapehei	k i p e h e # ; # k a p e h e i
1250	1987	Kähler 1987	218	1987K	ĩkãhãõ	ĩkãhãõ	ĩ k ã h ã õ	ĩkãhãɔ͂	ĩ k ã h ã ɔ͂
1251	1987	Kähler 1987	219	1987K	ikoʔoki	iko'oki	i k o ' o k i	ikoʔoki	i k o ʔ o k i
1252	1987	Kähler 1987	220	1987K	ĩkũkã	ĩkũkã	ĩ k ũ k ã	ĩkũkã	ĩ k ũ k ã
1254	1987	Kähler 1987	221	1987K	ipou	ipou	i p o u	ipou	i p o u
1255	1987	Kähler 1987	222	1987K	kahã͜ĩkũ	kahã:ĩkũ	k a h ã: ĩ k ũ	kahã͜ĩkũ	k a h ã͜ ĩ k ũ
1266	1987	Kähler 1987	224	1987K	itopo	itopo	i t o p o	itopo	i t o p o
1271	1987	Kähler 1987	225	1987K	eʔokodo	e'okodo	e ' o k o d o	eʔokodo	e ʔ o k o d o
1292	1987	Kähler 1987	231	1987K	a͜iʔĩã	a:i'ĩã	a: i ' ĩ ã	a͜iʔĩã	a͜ i ʔ ĩ ã
1297	1987	Kähler 1987	232	1987K	ʔãmũhõ	'ãmũhõ	' ã m ũ h õ	ʔãmũhɔ͂	ʔ ã m ũ h ɔ͂
1304	1987	Kähler 1987	234	1987K	enãẽ uae	enãẽ uae	e n ã ẽ # u a e	enãẽ uae	e n ã ẽ # u a e
1315	1987	Kähler 1987	235	1987K	ekẽʔẽpã	ekẽ'ẽpã	e k ẽ ' ẽ p ã	ekẽʔẽpã	e k ẽ ʔ ẽ p ã
1323	1987	Kähler 1987	236	1987K	ekahaba	ekahaba	e k a h a b a	ekahaba	e k a h a b a
1324	1987	Kähler 1987	237	1987K	eaʔa(ʔa)da	ea'a('a)da	e a ' a ( ' a ) d a	eaʔa(ʔa)da	e a ʔ a ( ʔ a ) d a
1329	1987	Kähler 1987	238	1987K	kixau	kixau	k i x a u	kiçau	k i ç a u
1340	1987	Kähler 1987	240	1987K	kaʔadahəa͜i	ka'adahu̇a:i	k a ' a d a h u̇ a: i	kaʔadahɨa͜i	k a ʔ a d a h ɨ a͜ i
1346	1987	Kähler 1987	241	1987K	kahedo	kahedo	k a h e d o	kahedo	k a h e d o
1354	1987	Kähler 1987	242	1987K	kaʔakõhõ	ka'akõhõ	k a ' a k õ h õ	kaʔakɔ͂hɔ͂	k a ʔ a k ɔ͂ h ɔ͂
1362	1987	Kähler 1987	243	1987K	kaʔũʔũĩ ; kãʔã͜uĩ	ka'ũ'ũĩ ; kã'ã:uĩ	k a ' ũ ' ũ ĩ # ; # k ã ' ã: u ĩ	kaʔũʔũĩ ; kãʔã͜uĩ	k a ʔ ũ ʔ ũ ĩ # ; # k ã ʔ ã͜ u ĩ
1367	1987	Kähler 1987	245	1987K	eõkõpĩ	eõkõpĩ	e õ k õ p ĩ	eɔ͂kɔ͂pĩ	e ɔ͂ k ɔ͂ p ĩ
1368	1987	Kähler 1987	246	1987K	eaʔãkũ	ea'ãkũ	e a ' ã k ũ	eaʔãkũ	e a ʔ ã k ũ
1376	1987	Kähler 1987	248	1987K	kãʔãkẽnẽ ebaka	kã'ãkẽnẽ ebaka	k ã ' ã k ẽ n ẽ # e b a k a	kãʔãkẽnẽ ebaka	k ã ʔ ã k ẽ n ẽ # e b a k a
1382	1987	Kähler 1987	249	1987K	ekiáki	ekiáki	e k i á k i	ekiáki	e k i á k i
1390	1987	Kähler 1987	250	1987K	kapoi	kapoi	k a p o i	kapoi	k a p o i
1396	1987	Kähler 1987	251	1987K	kikehə́ʔəa	kikehu̇́'u̇a	k i k e h u̇́ ' u̇ a	kikehɨ́ʔɨa	k i k e h ɨ́ ʔ ɨ a
1400	1987	Kähler 1987	252	1987K	kãhãũ	kãhãũ	k ã h ã ũ	kãhãũ	k ã h ã ũ
1409	1987	Kähler 1987	256	1987K	ekaraha	ekaraha	e k a r a h a	ekaraha	e k a r a h a
1415	1987	Kähler 1987	257	1987K	ekudodo	ekudodo	e k u d o d o	ekudodo	e k u d o d o
1419	1987	Kähler 1987	258	1987K	epurudui [ukaraha]	epurudui [ukaraha]	e p u r u d u i # [ u k a r a h a ]	epurudui [ukaraha]	e p u r u d u i # [ u k a r a h a ]
1423	1987	Kähler 1987	260	1987K	ekarepe	ekarepe	e k a r e p e	ekarepe	e k a r e p e
1429	1987	Kähler 1987	262	1987K	puʔuda: ; kipuda ; kapuda ; kababuda	pu'uda: ; kipuda ; kapuda ; kababuda	p u ' u d a : # ; # k i p u d a # ; # k a p u d a # ; # k a b a b u d a	puʔuda: ; kipuda ; kapuda ; kababuda	p u ʔ u d a : # ; # k i p u d a # ; # k a p u d a # ; # k a b a b u d a
1442	1987	Kähler 1987	265	1987K	eʔā [ukaraha]	e'aa [ukaraha]	e ' aa # [ u k a r a h a ]	eʔaː [ukaraha]	e ʔ aː # [ u k a r a h a ]
1449	1987	Kähler 1987	266	1987K	epanãʔã͜uã	epanã'ã:uã	e p a n ã ' ã: u ã	epanãʔã͜uã	e p a n ã ʔ ã͜ u ã
1459	1987	Kähler 1987	271	1987K	eipikoʔo͜i	eipiko'o:i	e i p i k o ' o: i	eipikoʔo͜i	e i p i k o ʔ o͜ i
1466	1987	Kähler 1987	273	1987K	ekarixai uʔapo	ekarixai u'apo	e k a r i x a i # u ' a p o	ekariçai uʔapo	e k a r i ç a i # u ʔ a p o
1470	1987	Kähler 1987	275	1987K	ekoporiʔío [ūdu] ; ekoropiʔío	ekopori'ío [uudu] ; ekoropi'ío	e k o p o r i ' í o # [ uu d u ] # ; # e k o r o p i ' í o	ekoporiʔio [uːdu] ; ekoropiʔio	e k o p o r i ʔ i o # [ uː d u ] # ; # e k o r o p i ʔ i o
1474	1987	Kähler 1987	276	1987K	ekəʔa	eku̇'a	e k u̇ ' a	ekɨʔa	e k ɨ ʔ a
1477	1987	Kähler 1987	277	1987K	eʔapo ukuo	e'apo ukuo	e ' a p o # u k u o	eʔapo ukuo	e ʔ a p o # u k u o
1485	1987	Kähler 1987	282	1987K	kinãnãĩñãʔã	kinãnãĩñã'ã	k i n ã n ã ĩ ñ ã ' ã	kinãnãĩɲãʔã	k i n ã n ã ĩ ɲ ã ʔ ã
1492	1987	Kähler 1987	283	1987K	kikaraʔa	kikara'a	k i k a r a ' a	kikaraʔa	k i k a r a ʔ a
1496	1987	Kähler 1987	284	1987K	kikou	kikou	k i k o u	kikou	k i k o u
1501	1987	Kähler 1987	285	1987K	kikōʔõʔã	kikoo'õ'ã	k i k oo ' õ ' ã	kikoːʔɔ͂ʔã	k i k oː ʔ ɔ͂ ʔ ã
1504	1987	Kähler 1987	286	1987K	kipakəʔa	kipaku̇'a	k i p a k u̇ ' a	kipakɨʔa	k i p a k ɨ ʔ a
1505	1987	Kähler 1987	287	1987K	kunãʔã	kunã'ã	k u n ã ' ã	kunãʔã	k u n ã ʔ ã
1508	1987	Kähler 1987	288	1987K	kikopi	kikopi	k i k o p i	kikopi	k i k o p i
1512	1987	Kähler 1987	289	1987K	kipə́aʔa ; kabupə́aʔa ; ka(haba)bə́aʔa	kipu̇́a'a ; kabupu̇́a'a ; ka(haba)bu̇́a'a	k i p u̇́ a ' a # ; # k a b u p u̇́ a ' a # ; # k a ( h a b a ) b u̇́ a ' a	kipɨ́aʔa ; kabupɨ́aʔa ; ka(haba)bɨ́aʔa	k i p ɨ́ a ʔ a # ; # k a b u p ɨ́ a ʔ a # ; # k a ( h a b a ) b ɨ́ a ʔ a
1516	1987	Kähler 1987	290	1987K	kixekoʔoáʔa	kixeko'oá'a	k i x e k o ' o á ' a	kiçekoʔoáʔa	k i ç e k o ʔ o á ʔ a
1527	1987	Kähler 1987	292	1987K	ekoko	ekoko	e k o k o	ekoko	e k o k o
1533	1987	Kähler 1987	294	1987K	ebē ukoko	ebee ukoko	e b ee # u k o k o	ebeː ukoko	e b eː # u k o k o
1534	1987	Kähler 1987	295	1987K	eʔā uãmãhã	e'aa uãmãhã	e ' aa # u ã m ã h ã	eʔaː uãmãhã	e ʔ aː # u ã m ã h ã
1539	1987	Kähler 1987	296	1987K	kipa(ha)koko	kipa(ha)koko	k i p a ( h a ) k o k o	kipa(ha)koko	k i p a ( h a ) k o k o
1543	1987	Kähler 1987	297	1987K	eahõpṍʔõ	eahõpṍ'õ	e a h õ p ṍ ' õ	eahɔ͂pɔ̃́ʔɔ͂	e a h ɔ͂ p ɔ̃́ ʔ ɔ͂
1545	1987	Kähler 1987	298	1987K	kixõpõʔõ ; kiõhõpõʔõ	kixõpõ'õ ; kiõhõpõ'õ	k i x õ p õ ' õ # ; # k i õ h õ p õ ' õ	kiçɔ͂pɔ͂ʔɔ͂ ; kiɔ͂hɔ͂pɔ͂ʔɔ͂	k i ç ɔ͂ p ɔ͂ ʔ ɔ͂ # ; # k i ɔ͂ h ɔ͂ p ɔ͂ ʔ ɔ͂
1552	1987	Kähler 1987	299	1987K	kipukõʔõ͜i	kipukõ'õ:i	k i p u k õ ' õ: i	kipukɔ͂ʔɔ̃͜i	k i p u k ɔ͂ ʔ ɔ̃͜ i
1555	1987	Kähler 1987	300	1987K	ekõmẽã	ekõmẽã	e k õ m ẽ ã	ekɔ͂mẽã	e k ɔ͂ m ẽ ã
1562	1987	Kähler 1987	301	1987K	ka(mã)nĩkã	ka(mã)nĩkã	k a ( m ã ) n ĩ k ã	ka(mã)nĩkã	k a ( m ã ) n ĩ k ã
1570	1987	Kähler 1987	302	1987K	kamãnãʔã ; kinãʔã ; kaʔinãʔã u- ; nãʔã͜õ	kamãnã'ã ; kinã'ã ; ka'inã'ã u- ; nã'ã:õ	k a m ã n ã ' ã # ; # k i n ã ' ã # ; # k a ' i n ã ' ã # u - # ; # n ã ' ã: õ	kamãnãʔã ; kinãʔã ; kaʔinãʔã u- ; nãʔã͜ɔ͂	k a m ã n ã ʔ ã # ; # k i n ã ʔ ã # ; # k a ʔ i n ã ʔ ã # u - # ; # n ã ʔ ã͜ ɔ͂
1574	1987	Kähler 1987	304	1987K	kahao	kahao	k a h a o	kahao	k a h a o
1581	1987	Kähler 1987	307	1987K	e(pa)əhəadi	e(pa)u̇hu̇adi	e ( p a ) u̇ h u̇ a d i	e(pa)ɨhɨadi	e ( p a ) ɨ h ɨ a d i
1589	1987	Kähler 1987	309	1987K	kipupu	kipupu	k i p u p u	kipupu	k i p u p u
1599	1987	Kähler 1987	315	1987K	emũʔĩñã	emũ'ĩñã	e m ũ ' ĩ ñ ã	emũʔĩɲã	e m ũ ʔ ĩ ɲ ã
1604	1987	Kähler 1987	317	1987K	ki-duduki	ki-duduki	k i - d u d u k i	ki-duduki	k i - d u d u k i
1609	1987	Kähler 1987	318	1987K	kikixo ; kadixo	kikixo ; kadixo	k i k i x o # ; # k a d i x o	kikiço ; kadiço	k i k i ç o # ; # k a d i ç o
1614	1987	Kähler 1987	321	1987K	kah(a͜)ibi	kah(a:)ibi	k a h ( a :) i b i	kah(a͜)ibi	k a h ( a͜ ) i b i
1618	1987	Kähler 1987	323	1987K	kadeʔo	kade'o	k a d e ' o	kadeʔo	k a d e ʔ o
1622	1987	Kähler 1987	324	1987K	kikeʔo	kike'o	k i k e ' o	kikeʔo	k i k e ʔ o
1625	1987	Kähler 1987	325	1987K	eabúa	eabúa	e a b ú a	eabúa	e a b ú a
1629	1987	Kähler 1987	327	1987K	ke	ke	k e	ke	k e
1635	1987	Kähler 1987	328	1987K	epãʔõpãʔõ ; epõʔõpãõ	epã'õpã'õ ; epõ'õpãõ	e p ã ' õ p ã ' õ # ; # e p õ ' õ p ã õ	epãʔɔ͂pãʔɔ͂ ; epɔ͂ʔɔ͂pãɔ͂	e p ã ʔ ɔ͂ p ã ʔ ɔ͂ # ; # e p ɔ͂ ʔ ɔ͂ p ã ɔ͂
1639	1987	Kähler 1987	329	1987K	ehokai ; ehõkãĩ	ehokai ; ehõkãĩ	e h o k a i # ; # e h õ k ã ĩ	ehokai ; ehɔ͂kãĩ	e h o k a i # ; # e h ɔ͂ k ã ĩ
1640	1987	Kähler 1987	330	1987K	ẽnãnĩ	ẽnãnĩ	ẽ n ã n ĩ	ẽnãnĩ	ẽ n ã n ĩ
1643	1987	Kähler 1987	331	1987K	ʔo ; ʔō ; iʔiō	'o ; 'oo ; i'ioo	' o # ; # ' oo # ; # i ' i oo	ʔo ; ʔoː ; iʔioː	ʔ o # ; # ʔ oː # ; # i ʔ i oː
1652	1987	Kähler 1987	335	1987K	epĩõpĩõ ; epĩəpĩə	epĩõpĩõ ; epĩu̇pĩu̇	e p ĩ õ p ĩ õ # ; # e p ĩ u̇ p ĩ u̇	epĩɔ͂pĩɔ͂ ; epĩɨpĩɨ	e p ĩ ɔ͂ p ĩ ɔ͂ # ; # e p ĩ ɨ p ĩ ɨ
1658	1987	Kähler 1987	336	1987K	kahadi	kahadi	k a h a d i	kahadi	k a h a d i
1665	1987	Kähler 1987	338	1987K	kipəhai ; pohoi	kipu̇hai ; pohoi	k i p u̇ h a i # ; # p o h o i	kipɨhai ; pohoi	k i p ɨ h a i # ; # p o h o i
1678	1987	Kähler 1987	344	1987K	eopoʔoki	eopo'oki	e o p o ' o k i	eopoʔoki	e o p o ʔ o k i
1680	1987	Kähler 1987	346	1987K	earoʔoa	earo'oa	e a r o ' o a	earoʔoa	e a r o ʔ o a
1682	1987	Kähler 1987	347	1987K	kũpã	kũpã	k ũ p ã	kũpã	k ũ p ã
1689	1987	Kähler 1987	349	1987K	kole ; kore ; kode	kole ; kore ; kode	k o l e # ; # k o r e # ; # k o d e	kole ; kore ; kode	k o l e # ; # k o r e # ; # k o d e
1691	1987	Kähler 1987	350	1987K	kamẽhẽnĩ	kamẽhẽnĩ	k a m ẽ h ẽ n ĩ	kamẽhẽnĩ	k a m ẽ h ẽ n ĩ
1693	1987	Kähler 1987	352	1987K	ekixẽnȭ	ekixẽnõõ	e k i x ẽ n õõ	ekiçẽnɔ̃ː	e k i ç ẽ n ɔ̃ː
1700	1987	Kähler 1987	353	1987K	ebao	ebao	e b a o	ebao	e b a o
1707	1987	Kähler 1987	354	1987K	ekikoha	ekikoha	e k i k o h a	ekikoha	e k i k o h a
1710	1987	Kähler 1987	355	1987K	kipa͜iʔio	kipa:i'io	k i p a: i ' i o	kipa͜iʔio	k i p a͜ i ʔ i o
1714	1987	Kähler 1987	357	1987K	eʔoʔoboi	e'o'oboi	e ' o ' o b o i	eʔoʔoboi	e ʔ o ʔ o b o i
1717	1987	Kähler 1987	358	1987K	kipuʔeʔe͜i ; kabuʔeʔe͜i	kipu'e'e:i ; kabu'e'e:i	k i p u ' e ' e: i # ; # k a b u ' e ' e: i	kipuʔeʔe͜i ; kabuʔeʔe͜i	k i p u ʔ e ʔ e͜ i # ; # k a b u ʔ e ʔ e͜ i
1722	1987	Kähler 1987	359	1987K	emẽ́ãũ	emẽ́ãũ	e m ẽ́ ã ũ	emẽ́ãũ	e m ẽ́ ã ũ
1727	1987	Kähler 1987	361	1987K	kidaʔa(o)	kida'a(o)	k i d a ' a ( o )	kidaʔa(o)	k i d a ʔ a ( o )
1732	1987	Kähler 1987	363	1987K	kõnõʔõ	kõnõ'õ	k õ n õ ' õ	kɔ͂nɔ͂ʔɔ͂	k ɔ͂ n ɔ͂ ʔ ɔ͂
1736	1987	Kähler 1987	366	1987K	epohanũmã ; epohonũmã	epohanũmã ; epohonũmã	e p o h a n ũ m ã # ; # e p o h o n ũ m ã	epohanũmã ; epohonũmã	e p o h a n ũ m ã # ; # e p o h o n ũ m ã
1737	1987	Kähler 1987	367	1987K	kitaháu	kitaháu	k i t a h á u	kitaháu	k i t a h á u
1754	1987	Kähler 1987	373	1987K	ekõhõ uʔobi	ekõhõ u'obi	e k õ h õ # u ' o b i	ekɔ͂hɔ͂ uʔobi	e k ɔ͂ h ɔ͂ # u ʔ o b i
1757	1987	Kähler 1987	374	1987K	kakakrei ; kikakadei ; kakarai	kakakrei ; kikakadei ; kakarai	k a k a k r e i # ; # k i k a k a d e i # ; # k a k a r a i	kakakrei ; kikakadei ; kakarai	k a k a k r e i # ; # k i k a k a d e i # ; # k a k a r a i
1761	1987	Kähler 1987	375	1987K	hĩnũkĩ eodi	hĩnũkĩ eodi	h ĩ n ũ k ĩ # e o d i	hĩnũkĩ eodi	h ĩ n ũ k ĩ # e o d i
1768	1987	Kähler 1987	376	1987K	epapa	epapa	e p a p a	epapa	e p a p a
1788	1987	Kähler 1987	380	1987K	pamoa	pamoa	p a m o a	pamoa	p a m o a
1829	1987	Kähler 1987	393	1987K	enãpĩnãpĩ	enãpĩnãpĩ	e n ã p ĩ n ã p ĩ	enãpĩnãpĩ	e n ã p ĩ n ã p ĩ
1832	1987	Kähler 1987	394	1987K	ekãpũ	ekãpũ	e k ã p ũ	ekãpũ	e k ã p ũ
1845	1987	Kähler 1987	399	1987K	eʔaduku	e'aduku	e ' a d u k u	eʔaduku	e ʔ a d u k u
1863	1987	Kähler 1987	405	1987K	kede ; kah(a)ede	kede ; kah(a)ede	k e d e # ; # k a h ( a ) e d e	kede ; kah(a)ede	k e d e # ; # k a h ( a ) e d e
1874	1987	Kähler 1987	410	1987K	kahaʔũkī́ʔĩ	kaha'ũkíí'ĩ	k a h a ' ũ k íí ' ĩ	kahaʔũkiːʔĩ	k a h a ʔ ũ k iː ʔ ĩ
1886	1987	Kähler 1987	415	1987K	ẽ-kãẽnĩ	ẽ-kãẽnĩ	ẽ - k ã ẽ n ĩ	ẽ-kãẽnĩ	ẽ - k ã ẽ n ĩ
1889	1987	Kähler 1987	416	1987K	e-opouda	e-opouda	e - o p o u d a	e-opouda	e - o p o u d a
1901	1987	Kähler 1987	421	1987K	e-kai u-dahauhu	e-kai u-dahauhu	e - k a i # u - d a h a u h u	e-kai u-dahauhu	e - k a i # u - d a h a u h u
