entry_id	year	EngganoSource	id	year_id	words	commons	commons_tokenised	ipa	ipa_tokenised
3970	2019	Aron 2019	1198	2019	ubi	ubi	u b i	ubi	u b i
3976	2019	Aron 2019	1202	2019	kara'a	kara'a	k a r a ' a	karaʔa	k a r a ʔ a
3978	2019	Aron 2019	1203	2019	kuka'ah	kuka'ah	k u k a ' a h	kukaʔah	k u k a ʔ a h
3984	2019	Aron 2019	1208	2019	tere	tere	t e r e	tere	t e r e
3986	2019	Aron 2019	1209	2019	kuti	kuti	k u t i	kuti	k u t i
3990	2019	Aron 2019	1210	2019	kahtepa	kahtepa	k a h t e p a	kahtepa	k a h t e p a
4002	2019	Aron 2019	1212	2019	kabahtare	kabahtare	k a b a h t a r e	kabahtare	k a b a h t a r e
4037	2019	Aron 2019	1220	2019	pu'	pu'	p u '	puʔ	p u ʔ
4062	2019	Aron 2019	1227	2019	pakõ'ã	pakõ'ã	p a k õ ' ã	pakɔ͂ʔã	p a k ɔ͂ ʔ ã
4084	2019	Aron 2019	1237	2019	nanau	nanau	n a n a u	nanau	n a n a u
4092	2019	Aron 2019	1242	2019	napu	napu	n a p u	napu	n a p u
4097	2019	Aron 2019	1244	2019	kã'ẽ	kã'ẽ	k ã ' ẽ	kãʔẽ	k ã ʔ ẽ
4098	2019	Aron 2019	1245	2019	kã'ũẽ	kã'ũẽ	k ã ' ũ ẽ	kãʔũẽ	k ã ʔ ũ ẽ
4111	2019	Aron 2019	1251	2019	na'an	na'an	n a ' a n	naʔan	n a ʔ a n
4117	2019	Aron 2019	1252	2019	kė'kah	kė'kah	k ė ' k a h	kәʔkah	k ә ʔ k a h
4132	2019	Aron 2019	1256	2019	kokoi'ea	kokoi'ea	k o k o i ' e a	kokoiʔea	k o k o i ʔ e a
4142	2019	Aron 2019	1257	2019	purdu kibuh	purdu kibuh	p u r d u # k i b u h	purdu kibuh	p u r d u # k i b u h
4158	2019	Aron 2019	1263	2019	kahyabih	kahyabih	k a h y a b i h	kahjabih	k a h j a b i h
4159	2019	Aron 2019	1264	2019	kibih	kibih	k i b i h	kibih	k i b i h
4161	2019	Aron 2019	1265	2019	kipeyar	kipeyar	k i p e y a r	kipejar	k i p e j a r
4173	2019	Aron 2019	1270	2019	ẽp	ẽp	ẽ p	ẽp	ẽ p
4193	2019	Aron 2019	1276	2019	are'	are'	a r e '	areʔ	a r e ʔ
4223	2019	Aron 2019	1292	2019	iud	iud	i u d	iud	i u d
4228	2019	Aron 2019	1294	2019	kor	kor	k o r	kor	k o r
4238	2019	Aron 2019	1296	2019	edoab	edoab	e d o a b	edoab	e d o a b
4245	2019	Aron 2019	1299	2019	nėah	nėah	n ė a h	nәah	n ә a h
4250	2019	Aron 2019	1300	2019	kinėah	kinėah	k i n ė a h	kinәah	k i n ә a h
4254	2019	Aron 2019	1301	2019	kinė'ė	kinė'ė	k i n ė ' ė	kinәʔә	k i n ә ʔ ә
4260	2019	Aron 2019	1304	2019	keiyer	keiyer	k e i y e r	keijer	k e i j e r
4262	2019	Aron 2019	1305	2019	ki'nen	ki'nen	k i ' n e n	kiʔnen	k i ʔ n e n
4264	2019	Aron 2019	1306	2019	kĩpã'õpã	kĩpã'õpã	k ĩ p ã ' õ p ã	kĩpãʔɔ͂pã	k ĩ p ã ʔ ɔ͂ p ã
4270	2019	Aron 2019	1307	2019	yakorip	yakorip	y a k o r i p	jakorip	j a k o r i p
4280	2019	Aron 2019	1309	2019	ekem	ekem	e k e m	ekem	e k e m
4286	2019	Aron 2019	1313	2019	ara'iah	ara'iah	a r a ' i a h	araʔiah	a r a ʔ i a h
4292	2019	Aron 2019	1316	2019	ma'au ; ma'ua	ma'au ; ma'ua	m a ' a u # ; # m a ' u a	maʔau ; maʔua	m a ʔ a u # ; # m a ʔ u a
4310	2019	Aron 2019	1326	2019	kipė	kipė	k i p ė	kipә	k i p ә
4312	2019	Aron 2019	1327	2019	kuan	kuan	k u a n	kuan	k u a n
4319	2019	Aron 2019	1329	2019	kikior	kikior	k i k i o r	kikior	k i k i o r
4327	2019	Aron 2019	1330	2019	hĩyũk	hĩyũk	h ĩ y ũ k	hĩjũk	h ĩ j ũ k
4333	2019	Aron 2019	1335	2019	kah(e)ko'a	kah(e)ko'a	k a h ( e ) k o ' a	kah(e)koʔa	k a h ( e ) k o ʔ a
4341	2019	Aron 2019	1338	2019	pahkokoa	pahkokoa	p a h k o k o a	pahkokoa	p a h k o k o a
4353	2019	Aron 2019	1341	2019	ka'ėk	ka'ėk	k a ' ė k	kaʔәk	k a ʔ ә k
4357	2019	Aron 2019	1343	2019	bėkikėnah	bėkikėnah	b ė k i k ė n a h	bәkikәnah	b ә k i k ә n a h
4368	2019	Aron 2019	1351	2019	ki'mė	ki'mė	k i ' m ė	kiʔmә	k i ʔ m ә
4382	2019	Aron 2019	1352	2019	pėic	pėic	p ė i c	pәit͡ʃ	p ә i t͡ʃ
4387	2019	Aron 2019	1354	2019	pic	pic	p i c	pit͡ʃ	p i t͡ʃ
4391	2019	Aron 2019	1357	2019	kak kiparuhuha	kak kiparuhuha	k a k # k i p a r u h u h a	kak kiparuhuha	k a k # k i p a r u h u h a
4392	2019	Aron 2019	1358	2019	hiyo yuba	hiyo yuba	h i y o # y u b a	hijo juba	h i j o # j u b a
4410	2019	Aron 2019	1369	2019	yėki	yėki	y ė k i	jәki	j ә k i
4412	2019	Aron 2019	1370	2019	awa'	awa'	a w a '	awaʔ	a w a ʔ
4425	2019	Aron 2019	1371	2019	mėk	mėk	m ė k	mәk	m ә k
4445	2019	Aron 2019	1380	2019	kipabia	kipabia	k i p a b i a	kipabia	k i p a b i a
4458	2019	Aron 2019	1384	2019	edapik	edapik	e d a p i k	edapik	e d a p i k
4470	2019	Aron 2019	1391	2019	kė̃	kė̃	k ė ̃	kә̃	k ә ̃
4475	2019	Aron 2019	1392	2019	ube	ube	u b e	ube	u b e
4481	2019	Aron 2019	1394	2019	kipakob	kipakob	k i p a k o b	kipakob	k i p a k o b
4488	2019	Aron 2019	1395	2019	pahnaua	pahnaua	p a h n a u a	pahnaua	p a h n a u a
4490	2019	Aron 2019	1396	2019	pahnaua	pahnaua	p a h n a u a	pahnaua	p a h n a u a
4506	2019	Aron 2019	1403	2019	yũ'ũ	yũ'ũ	y ũ ' ũ	jũʔũ	j ũ ʔ ũ
4531	2019	Aron 2019	1417	2019	pahitėi	pahitėi	p a h i t ė i	pahitәi	p a h i t ә i
4537	2019	Aron 2019	1421	2019	dupi	dupi	d u p i	dupi	d u p i
4539	2019	Aron 2019	1422	2019	iyuk	iyuk	i y u k	ijuk	i j u k
4540	2019	Aron 2019	1423	2019	eyuk	eyuk	e y u k	ejuk	e j u k
4558	2019	Aron 2019	1427	2019	kanėa	kanėa	k a n ė a	kanәa	k a n ә a
4578	2019	Aron 2019	1435	2019	epaiyh	epaiyh	e p a i y h	epaijh	e p a i j h
4586	2019	Aron 2019	1436	2019	ki'ia	ki'ia	k i ' i a	kiʔia	k i ʔ i a
4598	2019	Aron 2019	1438	2019	nai	nai	n a i	nai	n a i
4623	2019	Aron 2019	1442	2019	kėh	kėh	k ė h	kәh	k ә h
4642	2019	Aron 2019	1447	2019	ka	ka	k a	ka	k a
4657	2019	Aron 2019	1454	2019	ẽ'ẽõ	ẽ'ẽõ	ẽ ' ẽ õ	ẽʔẽɔ͂	ẽ ʔ ẽ ɔ͂
4661	2019	Aron 2019	1455	2019	kakedoke	kakedoke	k a k e d o k e	kakedoke	k a k e d o k e
4663	2019	Aron 2019	1456	2019	kabikbi(k)	kabikbi(k)	k a b i k b i ( k )	kabikbi(k)	k a b i k b i ( k )
4692	2019	Aron 2019	1469	2019	tanaia	tanaia	t a n a i a	tanaia	t a n a i a
4705	2019	Aron 2019	1471	2019	ni	ni	n i	ni	n i
4725	2019	Aron 2019	1477	2019	kipaiyo'oi	kipaiyo'oi	k i p a i y o ' o i	kipaijoʔoi	k i p a i j o ʔ o i
4732	2019	Aron 2019	1478	2019	puk	puk	p u k	puk	p u k
4743	2019	Aron 2019	1479	2019	pane	pane	p a n e	pane	p a n e
4757	2019	Aron 2019	1483	2019	ekĩk	ekĩk	e k ĩ k	ekĩk	e k ĩ k
4766	2019	Aron 2019	1486	2019	yaru	yaru	y a r u	jaru	j a r u
4796	2019	Aron 2019	1499	2019	komay	komay	k o m a y	komaj	k o m a j
4816	2019	Aron 2019	1502	2019	karko'eh ; ko'eh	karko'eh ; ko'eh	k a r k o ' e h # ; # k o ' e h	karkoʔeh ; koʔeh	k a r k o ʔ e h # ; # k o ʔ e h
4825	2019	Aron 2019	1504	2019	kaba kaha'i	kaba kaha'i	k a b a # k a h a ' i	kaba kahaʔi	k a b a # k a h a ʔ i
4845	2019	Aron 2019	1512	2019	ke'pan ; kep	ke'pan ; kep	k e ' p a n # ; # k e p	keʔpan ; kep	k e ʔ p a n # ; # k e p
4861	2019	Aron 2019	1519	2019	ke'yakė	ke'yakė	k e ' y a k ė	keʔjakә	k e ʔ j a k ә
4863	2019	Aron 2019	1520	2019	keab	keab	k e a b	keab	k e a b
4870	2019	Aron 2019	1522	2019	kep	kep	k e p	kep	k e p
4884	2019	Aron 2019	1527	2019	nė'ėn	nė'ėn	n ė ' ė n	nәʔәn	n ә ʔ ә n
4889	2019	Aron 2019	1528	2019	yė'ic	yė'ic	y ė ' i c	jәʔit͡ʃ	j ә ʔ i t͡ʃ
4950	2019	Aron 2019	1558	2019	dikėdeki	dikėdeki	d i k ė d e k i	dikәdeki	d i k ә d e k i
4956	2019	Aron 2019	1560	2019	kahboka ; kipukai ; kėpuka	kahboka ; kipukai ; kėpuka	k a h b o k a # ; # k i p u k a i # ; # k ė p u k a	kahboka ; kipukai ; kәpuka	k a h b o k a # ; # k i p u k a i # ; # k ә p u k a
4967	2019	Aron 2019	1565	2019	dakrah	dakrah	d a k r a h	dakrah	d a k r a h
4991	2019	Aron 2019	1578	2019	kadidih	kadidih	k a d i d i h	kadidih	k a d i d i h
5009	2019	Aron 2019	1581	2019	yė'ic	yė'ic	y ė ' i c	jәʔit͡ʃ	j ә ʔ i t͡ʃ
5017	2019	Aron 2019	1585	2019	kapuh	kapuh	k a p u h	kapuh	k a p u h
5038	2019	Aron 2019	1594	2019	kapaer	kapaer	k a p a e r	kapaer	k a p a e r
5040	2019	Aron 2019	1595	2019	parna	parna	p a r n a	parna	p a r n a
5046	2019	Aron 2019	1597	2019	kioyo'on	kioyo'on	k i o y o ' o n	kiojoʔon	k i o j o ʔ o n
5069	2019	Aron 2019	1607	2019	yakoro	yakoro	y a k o r o	jakoro	j a k o r o
5075	2019	Aron 2019	1610	2019	i	i	i	i	i
5080	2019	Aron 2019	1613	2019	pitoro	pitoro	p i t o r o	pitoro	p i t o r o
5094	2019	Aron 2019	1621	2019	paih	paih	p a i h	paih	p a i h
5100	2019	Aron 2019	1622	2019	edak	edak	e d a k	edak	e d a k
5105	2019	Aron 2019	1624	2019	roro	roro	r o r o	roro	r o r o
5106	2019	Aron 2019	1625	2019	kahnė	kahnė	k a h n ė	kahnә	k a h n ә
5108	2019	Aron 2019	1626	2019	kabarar	kabarar	k a b a r a r	kabarar	k a b a r a r
5134	2019	Aron 2019	1630	2019	koi	koi	k o i	koi	k o i
5151	2019	Aron 2019	1639	2019	tipi	tipi	t i p i	tipi	t i p i
5159	2019	Aron 2019	1644	2019	kideok	kideok	k i d e o k	kideok	k i d e o k
5160	2019	Aron 2019	1645	2019	napin	napin	n a p i n	napin	n a p i n
5180	2019	Aron 2019	1654	2019	na'inė	na'inė	n a ' i n ė	naʔinә	n a ʔ i n ә
5186	2019	Aron 2019	1657	2019	kė'ėh	kė'ėh	k ė ' ė h	kәʔәh	k ә ʔ ә h
5191	2019	Aron 2019	1658	2019	karėrė	karėrė	k a r ė r ė	karәrә	k a r ә r ә
5207	2019	Aron 2019	1665	2019	yumuh	yumuh	y u m u h	jumuh	j u m u h
5221	2019	Aron 2019	1670	2019	yo'o	yo'o	y o ' o	joʔo	j o ʔ o
5222	2019	Aron 2019	1671	2019	yukua	yukua	y u k u a	jukua	j u k u a
5230	2019	Aron 2019	1675	2019	kõ'ma	kõ'ma	k õ ' m a	kɔ͂ʔma	k ɔ͂ ʔ m a
5235	2019	Aron 2019	1678	2019	doiok	doiok	d o i o k	doiok	d o i o k
5236	2019	Aron 2019	1679	2019	ekaino	ekaino	e k a i n o	ekaino	e k a i n o
5242	2019	Aron 2019	1682	2019	kareke	kareke	k a r e k e	kareke	k a r e k e
5251	2019	Aron 2019	1686	2019	karo'a	karo'a	k a r o ' a	karoʔa	k a r o ʔ a
5265	2019	Aron 2019	1691	2019	yėr	yėr	y ė r	jәr	j ә r
5267	2019	Aron 2019	1692	2019	yub yahmii	yub yahmii	y u b # y a h m i i	jub jahmii	j u b # j a h m i i
5269	2019	Aron 2019	1693	2019	a'iur	a'iur	a ' i u r	aʔiur	a ʔ i u r
5290	2019	Aron 2019	1701	2019	anė'	anė'	a n ė '	anәʔ	a n ә ʔ
5292	2019	Aron 2019	1702	2019	anėk	anėk	a n ė k	anәk	a n ә k
5303	2019	Aron 2019	1709	2019	katubu'	katubu'	k a t u b u '	katubuʔ	k a t u b u ʔ
5305	2019	Aron 2019	1710	2019	yahmi(')	yahmi(')	y a h m i ( ' )	jahmi(ʔ)	j a h m i ( ʔ )
5320	2019	Aron 2019	1715	2019	ku'iya	ku'iya	k u ' i y a	kuʔija	k u ʔ i j a
5332	2019	Aron 2019	1719	2019	ãpũ	ãpũ	ã p ũ	ãpũ	ã p ũ
5336	2019	Aron 2019	1721	2019	kanih	kanih	k a n i h	kanih	k a n i h
5340	2019	Aron 2019	1722	2019	pã'ĩ	pã'ĩ	p ã ' ĩ	pãʔĩ	p ã ʔ ĩ
5345	2019	Aron 2019	1723	2019	panih	panih	p a n i h	panih	p a n i h
5349	2019	Aron 2019	1724	2019	kã'ĩ	kã'ĩ	k ã ' ĩ	kãʔĩ	k ã ʔ ĩ
5358	2019	Aron 2019	1728	2019	pã'õ ; pã'õ	pã'õ ; pã'õ	p ã ' õ # ; # p ã ' õ	pãʔɔ͂ ; pãʔɔ͂	p ã ʔ ɔ͂ # ; # p ã ʔ ɔ͂
5373	2019	Aron 2019	1734	2019	da'bu	da'bu	d a ' b u	daʔbu	d a ʔ b u
5398	2019	Aron 2019	1743	2019	kĩhĩ	kĩhĩ	k ĩ h ĩ	kĩhĩ	k ĩ h ĩ
5403	2019	Aron 2019	1744	2019	pu'a	pu'a	p u ' a	puʔa	p u ʔ a
5460	2019	Aron 2019	1765	2019	kakita	kakita	k a k i t a	kakita	k a k i t a
5471	2019	Aron 2019	1773	2019	yahbibi	yahbibi	y a h b i b i	jahbibi	j a h b i b i
5495	2019	Aron 2019	1784	2019	iėkih	iėkih	i ė k i h	iәkih	i ә k i h
5501	2019	Aron 2019	1785	2019	iėkih	iėkih	i ė k i h	iәkih	i ә k i h
5507	2019	Aron 2019	1788	2019	tawah	tawah	t a w a h	tawah	t a w a h
5524	2019	Aron 2019	1793	2019	edab	edab	e d a b	edab	e d a b
5534	2019	Aron 2019	1797	2019	kara'a	kara'a	k a r a ' a	karaʔa	k a r a ʔ a
5556	2019	Aron 2019	1803	2019	yakare	yakare	y a k a r e	jakare	j a k a r e
5565	2019	Aron 2019	1804	2019	bero	bero	b e r o	bero	b e r o
5583	2019	Aron 2019	1808	2019	eko ; yeko	eko ; yeko	e k o # ; # y e k o	eko ; jeko	e k o # ; # j e k o
5602	2019	Aron 2019	1815	2019	kõ'kõ	kõ'kõ	k õ ' k õ	kɔ͂ʔkɔ͂	k ɔ͂ ʔ k ɔ͂
5630	2019	Aron 2019	1825	2019	ẽãp	ẽãp	ẽ ã p	ẽãp	ẽ ã p
5649	2019	Aron 2019	1831	2019	kadi	kadi	k a d i	kadi	k a d i
5653	2019	Aron 2019	1832	2019	kadi bohoi	kadi bohoi	k a d i # b o h o i	kadi bohoi	k a d i # b o h o i
5657	2019	Aron 2019	1834	2019	ba'au	ba'au	b a ' a u	baʔau	b a ʔ a u
5661	2019	Aron 2019	1835	2019	karo	karo	k a r o	karo	k a r o
5663	2019	Aron 2019	1836	2019	ka'rarah	ka'rarah	k a ' r a r a h	kaʔrarah	k a ʔ r a r a h
5671	2019	Aron 2019	1837	2019	kabubu	kabubu	k a b u b u	kabubu	k a b u b u
5698	2019	Aron 2019	1850	2019	pu	pu	p u	pu	p u
5707	2019	Aron 2019	1857	2019	kõ'kõ	kõ'kõ	k õ ' k õ	kɔ͂ʔkɔ͂	k ɔ͂ ʔ k ɔ͂
5720	2019	Aron 2019	1863	2019	kanam	kanam	k a n a m	kanam	k a n a m
5740	2019	Aron 2019	1869	2019	dora	dora	d o r a	dora	d o r a
5757	2019	Aron 2019	1876	2019	kanimu	kanimu	k a n i m u	kanimu	k a n i m u
5768	2019	Aron 2019	1880	2019	ua ; ku'war	ua ; ku'war	u a # ; # k u ' w a r	ua ; kuʔwar	u a # ; # k u ʔ w a r
5776	2019	Aron 2019	1881	2019	kipana	kipana	k i p a n a	kipana	k i p a n a
5796	2019	Aron 2019	1889	2019	kinėnėn	kinėnėn	k i n ė n ė n	kinәnәn	k i n ә n ә n
5805	2019	Aron 2019	1893	2019	hĩõn	hĩõn	h ĩ õ n	hĩɔ͂n	h ĩ ɔ͂ n
5818	2019	Aron 2019	1895	2019	(e')yu	(e')yu	( e ' ) y u	(eʔ)ju	( e ʔ ) j u
5820	2019	Aron 2019	1896	2019	ha'au	ha'au	h a ' a u	haʔau	h a ʔ a u
5827	2019	Aron 2019	1900	2019	korea	korea	k o r e a	korea	k o r e a
5830	2019	Aron 2019	1901	2019	hyėh hẽku	hyėh hẽku	h y ė h # h ẽ k u	hjәh hẽku	h j ә h # h ẽ k u
5841	2019	Aron 2019	1903	2019	kipė	kipė	k i p ė	kipә	k i p ә
5854	2019	Aron 2019	1907	2019	kõ'kã	kõ'kã	k õ ' k ã	kɔ͂ʔkã	k ɔ͂ ʔ k ã
5870	2019	Aron 2019	1911	2019	kahėdia	kahėdia	k a h ė d i a	kahәdia	k a h ә d i a
5899	2019	Aron 2019	1921	2019	yahyai	yahyai	y a h y a i	jahjai	j a h j a i
5905	2019	Aron 2019	1924	2019	pėnahai	pėnahai	p ė n a h a i	pәnahai	p ә n a h a i
5913	2019	Aron 2019	1926	2019	kapẽp	kapẽp	k a p ẽ p	kapẽp	k a p ẽ p
5915	2019	Aron 2019	1927	2019	udėh	udėh	u d ė h	udәh	u d ә h
5918	2019	Aron 2019	1928	2019	ekit	ekit	e k i t	ekit	e k i t
5920	2019	Aron 2019	1929	2019	eyai kit	eyai kit	e y a i # k i t	ejai kit	e j a i # k i t
5928	2019	Aron 2019	1930	2019	ka'ėr	ka'ėr	k a ' ė r	kaʔәr	k a ʔ ә r
5948	2019	Aron 2019	1940	2019	baiu	baiu	b a i u	baiu	b a i u
5952	2019	Aron 2019	1941	2019	ẽk	ẽk	ẽ k	ẽk	ẽ k
5955	2019	Aron 2019	1942	2019	kẽmẽk	kẽmẽk	k ẽ m ẽ k	kẽmẽk	k ẽ m ẽ k
5965	2019	Aron 2019	1946	2019	kabė'ėk	kabė'ėk	k a b ė ' ė k	kabәʔәk	k a b ә ʔ ә k
5980	2019	Aron 2019	1950	2019	kakuė	kakuė	k a k u ė	kakuә	k a k u ә
5987	2019	Aron 2019	1952	2019	yamiyam	yamiyam	y a m i y a m	jamijam	j a m i j a m
5992	2019	Aron 2019	1954	2019	kipa'oa	kipa'oa	k i p a ' o a	kipaʔoa	k i p a ʔ o a
6005	2019	Aron 2019	1960	2019	pã'ẽk	pã'ẽk	p ã ' ẽ k	pãʔẽk	p ã ʔ ẽ k
6013	2019	Aron 2019	1964	2019	kanik	kanik	k a n i k	kanik	k a n i k
6030	2019	Aron 2019	1967	2019	kapuh	kapuh	k a p u h	kapuh	k a p u h
6039	2019	Aron 2019	1973	2019	pinohoi	pinohoi	p i n o h o i	pinohoi	p i n o h o i
6052	2019	Aron 2019	1976	2019	yohor	yohor	y o h o r	johor	j o h o r
6078	2019	Aron 2019	1981	2019	hẽk	hẽk	h ẽ k	hẽk	h ẽ k
6098	2019	Aron 2019	1990	2019	kahė	kahė	k a h ė	kahә	k a h ә
6103	2019	Aron 2019	1991	2019	kapẽk	kapẽk	k a p ẽ k	kapẽk	k a p ẽ k
6115	2019	Aron 2019	1992	2019	yuki	yuki	y u k i	juki	j u k i
6117	2019	Aron 2019	1993	2019	kã'ea'ea ; ka'eya'eya	kã'ea'ea ; ka'eya'eya	k ã ' e a ' e a # ; # k a ' e y a ' e y a	kãʔeaʔea ; kaʔejaʔeja	k ã ʔ e a ʔ e a # ; # k a ʔ e j a ʔ e j a
6135	2019	Aron 2019	1997	2019	ea dauh	ea dauh	e a # d a u h	ea dauh	e a # d a u h
6145	2019	Aron 2019	2002	2019	kanini'	kanini'	k a n i n i '	kaniniʔ	k a n i n i ʔ
6172	2019	Aron 2019	2010	2019	ku'eh	ku'eh	k u ' e h	kuʔeh	k u ʔ e h
6183	2019	Aron 2019	2016	2019	karneno	karneno	k a r n e n o	karneno	k a r n e n o
6208	2019	Aron 2019	2021	2019	nu'ik	nu'ik	n u ' i k	nuʔik	n u ʔ i k
6219	2019	Aron 2019	2026	2019	kiminu	kiminu	k i m i n u	kiminu	k i m i n u
6233	2019	Aron 2019	2029	2019	kano	kano	k a n o	kano	k a n o
6244	2019	Aron 2019	2035	2019	kãhĩp	kãhĩp	k ã h ĩ p	kãhĩp	k ã h ĩ p
6263	2019	Aron 2019	2043	2019	karerer	karerer	k a r e r e r	karerer	k a r e r e r
6288	2019	Aron 2019	2056	2019	eic	eic	e i c	eit͡ʃ	e i t͡ʃ
6324	2019	Aron 2019	2076	2019	dapah	dapah	d a p a h	dapah	d a p a h
6331	2019	Aron 2019	2079	2019	kė'hėI	kė'hėI	k ė ' h ė I	kәʔhәi	k ә ʔ h ә i
6333	2019	Aron 2019	2080	2019	kėhėi	kėhėi	k ė h ė i	kәhәi	k ә h ә i
6335	2019	Aron 2019	2081	2019	kikė'hėi	kikė'hėi	k i k ė ' h ė i	kikәʔhәi	k i k ә ʔ h ә i
6349	2019	Aron 2019	2089	2019	kahit	kahit	k a h i t	kahit	k a h i t
6355	2019	Aron 2019	2091	2019	kabora	kabora	k a b o r a	kabora	k a b o r a
6359	2019	Aron 2019	2092	2019	kahbola	kahbola	k a h b o l a	kahbola	k a h b o l a
6360	2019	Aron 2019	2093	2019	kaboė	kaboė	k a b o ė	kaboә	k a b o ә
6381	2019	Aron 2019	2104	2019	kamih	kamih	k a m i h	kamih	k a m i h
6388	2019	Aron 2019	2107	2019	kibi	kibi	k i b i	kibi	k i b i
6394	2019	Aron 2019	2108	2019	kirtahak	kirtahak	k i r t a h a k	kirtahak	k i r t a h a k
6404	2019	Aron 2019	2111	2019	hẽ	hẽ	h ẽ	hẽ	h ẽ
6435	2019	Aron 2019	2122	2019	ko'mim	ko'mim	k o ' m i m	koʔmim	k o ʔ m i m
6444	2019	Aron 2019	2125	2019	kikiar	kikiar	k i k i a r	kikiar	k i k i a r
6466	2019	Aron 2019	2134	2019	kidi'i	kidi'i	k i d i ' i	kidiʔi	k i d i ʔ i
6485	2019	Aron 2019	2144	2019	pahro'ia	pahro'ia	p a h r o ' i a	pahroʔia	p a h r o ʔ i a
6487	2019	Aron 2019	2145	2019	kahbua	kahbua	k a h b u a	kahbua	k a h b u a
6512	2019	Aron 2019	2149	2019	i'ė	i'ė	i ' ė	iʔә	i ʔ ә
6533	2019	Aron 2019	2156	2019	kaĩyõ	kaĩyõ	k a ĩ y õ	kaĩjɔ͂	k a ĩ j ɔ͂
6536	2019	Aron 2019	2157	2019	kãĩyõ	kãĩyõ	k ã ĩ y õ	kãĩjɔ͂	k ã ĩ j ɔ͂
6553	2019	Aron 2019	2165	2019	ẽ'ė	ẽ'ė	ẽ ' ė	ẽʔә	ẽ ʔ ә
6554	2019	Aron 2019	2166	2019	ẽyė	ẽyė	ẽ y ė	ẽjә	ẽ j ә
6555	2019	Aron 2019	2167	2019	ka'ė	ka'ė	k a ' ė	kaʔә	k a ʔ ә
6570	2019	Aron 2019	2172	2019	karopi	karopi	k a r o p i	karopi	k a r o p i
6608	2019	Aron 2019	2190	2019	kė'dėh	kė'dėh	k ė ' d ė h	kәʔdәh	k ә ʔ d ә h
6610	2019	Aron 2019	2191	2019	kėdėh	kėdėh	k ė d ė h	kәdәh	k ә d ә h
6616	2019	Aron 2019	2192	2019	kikėr	kikėr	k i k ė r	kikәr	k i k ә r
6626	2019	Aron 2019	2197	2019	yėmė	yėmė	y ė m ė	jәmә	j ә m ә
6631	2019	Aron 2019	2199	2019	kup	kup	k u p	kup	k u p
6645	2019	Aron 2019	2203	2019	ki'ĩãk	ki'ĩãk	k i ' ĩ ã k	kiʔĩãk	k i ʔ ĩ ã k
6651	2019	Aron 2019	2204	2019	kioyo'on	kioyo'on	k i o y o ' o n	kiojoʔon	k i o j o ʔ o n
6662	2019	Aron 2019	2209	2019	ebeya	ebeya	e b e y a	ebeja	e b e j a
6675	2019	Aron 2019	2212	2019	i'yo	i'yo	i ' y o	iʔjo	i ʔ j o
6700	2019	Aron 2019	2221	2019	udėp	udėp	u d ė p	udәp	u d ә p
6709	2019	Aron 2019	2225	2019	poro	poro	p o r o	poro	p o r o
6716	2019	Aron 2019	2227	2019	kĩpã'ãũ	kĩpã'ãũ	k ĩ p ã ' ã ũ	kĩpãʔãũ	k ĩ p ã ʔ ã ũ
6735	2019	Aron 2019	2235	2019	ẽyõ'	ẽyõ'	ẽ y õ '	ẽjɔ͂ʔ	ẽ j ɔ͂ ʔ
6759	2019	Aron 2019	2244	2019	iyo	iyo	i y o	ijo	i j o
6764	2019	Aron 2019	2245	2019	ĩ'yõ' ; ĩ'ĩõ	ĩ'yõ' ; ĩ'ĩõ	ĩ ' y õ ' # ; # ĩ ' ĩ õ	ĩʔjɔ͂ʔ ; ĩʔĩɔ͂	ĩ ʔ j ɔ͂ ʔ # ; # ĩ ʔ ĩ ɔ͂
6765	2019	Aron 2019	2246	2019	ĩ'ĩan	ĩ'ĩan	ĩ ' ĩ a n	ĩʔĩan	ĩ ʔ ĩ a n
6771	2019	Aron 2019	2247	2019	keab	keab	k e a b	keab	k e a b
6779	2019	Aron 2019	2250	2019	hamė	hamė	h a m ė	hamә	h a m ә
6785	2019	Aron 2019	2251	2019	kã'ãp	kã'ãp	k ã ' ã p	kãʔãp	k ã ʔ ã p
6807	2019	Aron 2019	2255	2019	kanene	kanene	k a n e n e	kanene	k a n e n e
6817	2019	Aron 2019	2258	2019	akita	akita	a k i t a	akita	a k i t a
6826	2019	Aron 2019	2260	2019	kihiė	kihiė	k i h i ė	kihiә	k i h i ә
6852	2019	Aron 2019	2266	2019	ẽ'	ẽ'	ẽ '	ẽʔ	ẽ ʔ
6873	2019	Aron 2019	2276	2019	yamako'a	yamako'a	y a m a k o ' a	jamakoʔa	j a m a k o ʔ a
6883	2019	Aron 2019	2277	2019	kahaik dibu	kahaik dibu	k a h a i k # d i b u	kahaik dibu	k a h a i k # d i b u
6902	2019	Aron 2019	2284	2019	hanu	hanu	h a n u	hanu	h a n u
6910	2019	Aron 2019	2286	2019	yahbai	yahbai	y a h b a i	jahbai	j a h b a i
6912	2019	Aron 2019	2287	2019	kahbai	kahbai	k a h b a i	kahbai	k a h b a i
6917	2019	Aron 2019	2288	2019	kipatu	kipatu	k i p a t u	kipatu	k i p a t u
6935	2019	Aron 2019	2296	2019	koni'i	koni'i	k o n i ' i	koniʔi	k o n i ʔ i
6936	2019	Aron 2019	2297	2019	konkoni'i	konkoni'i	k o n k o n i ' i	konkoniʔi	k o n k o n i ʔ i
6947	2019	Aron 2019	2299	2019	kah'ėa	kah'ėa	k a h ' ė a	kahʔәa	k a h ʔ ә a
6956	2019	Aron 2019	2304	2019	kahdih	kahdih	k a h d i h	kahdih	k a h d i h
6963	2019	Aron 2019	2307	2019	kipiak	kipiak	k i p i a k	kipiak	k i p i a k
6997	2019	Aron 2019	2319	2019	na'uman	na'uman	n a ' u m a n	naʔuman	n a ʔ u m a n
7010	2019	Aron 2019	2320	2019	ediė	ediė	e d i ė	ediә	e d i ә
7021	2019	Aron 2019	2322	2019	eka'	eka'	e k a '	ekaʔ	e k a ʔ
7031	2019	Aron 2019	2325	2019	ki'kapik	ki'kapik	k i ' k a p i k	kiʔkapik	k i ʔ k a p i k
7038	2019	Aron 2019	2328	2019	anu'un	anu'un	a n u ' u n	anuʔun	a n u ʔ u n
7043	2019	Aron 2019	2331	2019	adu	adu	a d u	adu	a d u
7057	2019	Aron 2019	2337	2019	enoh	enoh	e n o h	enoh	e n o h
7060	2019	Aron 2019	2338	2019	yėh enoh	yėh enoh	y ė h # e n o h	jәh enoh	j ә h # e n o h
7070	2019	Aron 2019	2341	2019	eku	eku	e k u	eku	e k u
7087	2019	Aron 2019	2349	2019	karoa	karoa	k a r o a	karoa	k a r o a
7091	2019	Aron 2019	2350	2019	kitėp	kitėp	k i t ė p	kitәp	k i t ә p
7097	2019	Aron 2019	2353	2019	kariprip	kariprip	k a r i p r i p	kariprip	k a r i p r i p
7104	2019	Aron 2019	2357	2019	kipah kadiak	kipah kadiak	k i p a h # k a d i a k	kipah kadiak	k i p a h # k a d i a k
7108	2019	Aron 2019	2358	2019	kėh	kėh	k ė h	kәh	k ә h
7144	2019	Aron 2019	2370	2019	karep	karep	k a r e p	karep	k a r e p
7150	2019	Aron 2019	2372	2019	pãyũ	pãyũ	p ã y ũ	pãjũ	p ã j ũ
7181	2019	Aron 2019	2388	2019	kĩmĩk	kĩmĩk	k ĩ m ĩ k	kĩmĩk	k ĩ m ĩ k
7185	2019	Aron 2019	2390	2019	iyik	iyik	i y i k	ijik	i j i k
7187	2019	Aron 2019	2391	2019	kahiko ; kihko	kahiko ; kihko	k a h i k o # ; # k i h k o	kahiko ; kihko	k a h i k o # ; # k i h k o
7200	2019	Aron 2019	2395	2019	kanai	kanai	k a n a i	kanai	k a n a i
7203	2019	Aron 2019	2397	2019	kũ'hẽnẽ	kũ'hẽnẽ	k ũ ' h ẽ n ẽ	kũʔhẽnẽ	k ũ ʔ h ẽ n ẽ
7209	2019	Aron 2019	2401	2019	kũ'ãh	kũ'ãh	k ũ ' ã h	kũʔãh	k ũ ʔ ã h
7217	2019	Aron 2019	2404	2019	yok	yok	y o k	jok	j o k
7226	2019	Aron 2019	2406	2019	kaudar ; ka'udar	kaudar ; ka'udar	k a u d a r # ; # k a ' u d a r	kaudar ; kaʔudar	k a u d a r # ; # k a ʔ u d a r
7241	2019	Aron 2019	2409	2019	eic	eic	e i c	eit͡ʃ	e i t͡ʃ
7246	2019	Aron 2019	2411	2019	kikeo	kikeo	k i k e o	kikeo	k i k e o
7249	2019	Aron 2019	2412	2019	eo	eo	e o	eo	e o
7250	2019	Aron 2019	2413	2019	yėo	yėo	y ė o	jәo	j ә o
7251	2019	Aron 2019	2414	2019	eiyeo	eiyeo	e i y e o	eijeo	e i j e o
7263	2019	Aron 2019	2419	2019	ėm	ėm	ė m	әm	ә m
7272	2019	Aron 2019	2422	2019	ki'kėkė	ki'kėkė	k i ' k ė k ė	kiʔkәkә	k i ʔ k ә k ә
7276	2019	Aron 2019	2423	2019	yũkũ	yũkũ	y ũ k ũ	jũkũ	j ũ k ũ
7293	2019	Aron 2019	2429	2019	yaka'aik ; yakai	yaka'aik ; yakai	y a k a ' a i k # ; # y a k a i	jakaʔaik ; jakai	j a k a ʔ a i k # ; # j a k a i
7304	2019	Aron 2019	2430	2019	bėka'tahur	bėka'tahur	b ė k a ' t a h u r	bәkaʔtahur	b ә k a ʔ t a h u r
7315	2019	Aron 2019	2434	2019	pato	pato	p a t o	pato	p a t o
7319	2019	Aron 2019	2436	2019	kãkõ	kãkõ	k ã k õ	kãkɔ͂	k ã k ɔ͂
7328	2019	Aron 2019	2438	2019	a ; a'a'	a ; a'a'	a # ; # a ' a '	a ; aʔaʔ	a # ; # a ʔ a ʔ
7339	2019	Aron 2019	2440	2019	ik	ik	i k	ik	i k
7344	2019	Aron 2019	2443	2019	kahnek ; kahneo	kahnek ; kahneo	k a h n e k # ; # k a h n e o	kahnek ; kahneo	k a h n e k # ; # k a h n e o
7346	2019	Aron 2019	2444	2019	pahėn yaho	pahėn yaho	p a h ė n # y a h o	pahәn jaho	p a h ә n # j a h o
7354	2019	Aron 2019	2448	2019	kumu	kumu	k u m u	kumu	k u m u
7359	2019	Aron 2019	2450	2019	ka'mok	ka'mok	k a ' m o k	kaʔmok	k a ʔ m o k
7362	2019	Aron 2019	2451	2019	ka'be	ka'be	k a ' b e	kaʔbe	k a ʔ b e
7374	2019	Aron 2019	2453	2019	ei'ah	ei'ah	e i ' a h	eiʔah	e i ʔ a h
7388	2019	Aron 2019	2457	2019	nakuan	nakuan	n a k u a n	nakuan	n a k u a n
7399	2019	Aron 2019	2459	2019	i'iah	i'iah	i ' i a h	iʔiah	i ʔ i a h
7401	2019	Aron 2019	2460	2019	mo'ni	mo'ni	m o ' n i	moʔni	m o ʔ n i
7410	2019	Aron 2019	2466	2019	ebed	ebed	e b e d	ebed	e b e d
7422	2019	Aron 2019	2468	2019	hãi	hãi	h ã i	hãi	h ã i
7426	2019	Aron 2019	2470	2019	me	me	m e	me	m e
7464	2019	Aron 2019	2480	2019	hėn	hėn	h ė n	hәn	h ә n
7468	2019	Aron 2019	2481	2019	kibohe	kibohe	k i b o h e	kibohe	k i b o h e
7479	2019	Aron 2019	2487	2019	deda	deda	d e d a	deda	d e d a
7493	2019	Aron 2019	2492	2019	ididu	ididu	i d i d u	ididu	i d i d u
7495	2019	Aron 2019	2493	2019	kahtapih	kahtapih	k a h t a p i h	kahtapih	k a h t a p i h
7506	2019	Aron 2019	2499	2019	kahok	kahok	k a h o k	kahok	k a h o k
7516	2019	Aron 2019	2504	2019	ka'huė	ka'huė	k a ' h u ė	kaʔhuә	k a ʔ h u ә
7533	2019	Aron 2019	2508	2019	eku	eku	e k u	eku	e k u
7544	2019	Aron 2019	2512	2019	kariyė	kariyė	k a r i y ė	karijә	k a r i j ә
7569	2019	Aron 2019	2528	2019	kipaupek	kipaupek	k i p a u p e k	kipaupek	k i p a u p e k
7572	2019	Aron 2019	2529	2019	taha	taha	t a h a	taha	t a h a
7577	2019	Aron 2019	2531	2019	kipawap	kipawap	k i p a w a p	kipawap	k i p a w a p
7584	2019	Aron 2019	2533	2019	taud	taud	t a u d	taud	t a u d
7592	2019	Aron 2019	2536	2019	o'	o'	o '	oʔ	o ʔ
7599	2019	Aron 2019	2537	2019	bahaib	bahaib	b a h a i b	bahaib	b a h a i b
7601	2019	Aron 2019	2538	2019	ka'ikėh	ka'ikėh	k a ' i k ė h	kaʔikәh	k a ʔ i k ә h
7618	2019	Aron 2019	2541	2019	ari	ari	a r i	ari	a r i
7628	2019	Aron 2019	2546	2019	ki'ėai	ki'ėai	k i ' ė a i	kiʔәai	k i ʔ ә a i
